MagdaGilmore288@gmail.com,http://localhost:9000/me-in-loo/posts/140.jpg,Various thousand public significant Republican here.,1
MarkWilliams289@gmail.com,http://localhost:9000/me-in-loo/posts/141.jpg,Training college discussion event week.,0
MarthaMills290@gmail.com,None,Increase support conference since.,4
KristineHardison291@gmail.com,http://localhost:9000/me-in-loo/posts/142.jpg,Much subject new television kid really.,1
LillianHainley292@gmail.com,None,None,1
KevinVargas293@gmail.com,http://localhost:9000/me-in-loo/posts/143.jpg,None,2
CollinFrost294@gmail.com,None,First worker surface look bank type wind.,1
ChadParker295@gmail.com,None,Painting relationship administration citizen bank.,2
GingerChapman296@gmail.com,http://localhost:9000/me-in-loo/posts/144.jpg,None,0
MelodyJackson297@gmail.com,http://localhost:9000/me-in-loo/posts/145.jpg,None,3
CaitlinDunn298@gmail.com,http://localhost:9000/me-in-loo/posts/146.jpg,None,0
FernFlenory299@gmail.com,http://localhost:9000/me-in-loo/posts/147.jpg,If dream push agree agree.,1
EricVines300@gmail.com,http://localhost:9000/me-in-loo/posts/148.jpg,None,5
JasonSanchez301@gmail.com,http://localhost:9000/me-in-loo/posts/149.jpg,None,2
TerriDavis302@gmail.com,http://localhost:9000/me-in-loo/posts/15.jpg,None,1
BrittanyJimenez303@gmail.com,None,Might forward help office.,1
LouisWardell304@gmail.com,http://localhost:9000/me-in-loo/posts/150.jpg,Old billion size old week nation board.,0
JeffBlackwell305@gmail.com,http://localhost:9000/me-in-loo/posts/151.jpg,Boy radio news coach.,3
PatsyLamb306@gmail.com,http://localhost:9000/me-in-loo/posts/152.jpg,Report bad senior now.,0
GayleMotley307@gmail.com,http://localhost:9000/me-in-loo/posts/153.jpg,Increase war fill successful make across meet.,3
KevinSteveson308@gmail.com,http://localhost:9000/me-in-loo/posts/154.jpg,Science to author bad history still among.,1
DanielHolden309@gmail.com,http://localhost:9000/me-in-loo/posts/155.jpg,Single answer budget name natural few.,3
GaryGoldsmith310@gmail.com,http://localhost:9000/me-in-loo/posts/156.jpg,Method either over sort.,0
JamesHernandez311@gmail.com,http://localhost:9000/me-in-loo/posts/157.jpg,Image research appear current positive world.,3
RicardoTarlton312@gmail.com,http://localhost:9000/me-in-loo/posts/158.jpg,Speech increase radio wonder writer long surface.,73
GaryStewart313@gmail.com,http://localhost:9000/me-in-loo/posts/159.jpg,None,0
AlisonArons314@gmail.com,http://localhost:9000/me-in-loo/posts/16.jpg,None,3
JosephGleim315@gmail.com,http://localhost:9000/me-in-loo/posts/160.jpg,None,3
SusanCeladon316@gmail.com,http://localhost:9000/me-in-loo/posts/161.jpg,Listen effect rise shoulder feeling.,0
SamuelStedman317@gmail.com,http://localhost:9000/me-in-loo/posts/162.jpg,Performance only read star.,0
WillieDoolittle318@gmail.com,http://localhost:9000/me-in-loo/posts/163.jpg,Two policy between mention many.,0
JackJansen319@gmail.com,http://localhost:9000/me-in-loo/posts/164.jpg,Century maybe third top record threat.,1
RobertMendez320@gmail.com,http://localhost:9000/me-in-loo/posts/165.jpg,Note model best type daughter always again whatever.,198
KimberleyPeralez321@gmail.com,http://localhost:9000/me-in-loo/posts/166.jpg,Describe laugh building skin here guy.,0
JacobWillson322@gmail.com,http://localhost:9000/me-in-loo/posts/167.jpg,Defense back leg much somebody number hour.,0
JoanBooker323@gmail.com,http://localhost:9000/me-in-loo/posts/168.jpg,None,0
JamesBetz324@gmail.com,http://localhost:9000/me-in-loo/posts/169.jpg,None,0
GaryWeidner325@gmail.com,http://localhost:9000/me-in-loo/posts/17.jpg,Ahead vote majority trade friend office carry.,0
StephenMoriarity326@gmail.com,http://localhost:9000/me-in-loo/posts/170.jpg,Film which west play wonder seek.,0
MariaShemwell327@gmail.com,http://localhost:9000/me-in-loo/posts/171.jpg,None,0
SarahNix328@gmail.com,http://localhost:9000/me-in-loo/posts/172.jpg,Serve carry fish tax option.,0
MathewPlaut329@gmail.com,None,None,0
AnnaChambers330@gmail.com,None,West coach upon theory wonder identify performance.,0
LaurenScordato331@gmail.com,http://localhost:9000/me-in-loo/posts/173.jpg,None,0
MildredEvers332@gmail.com,http://localhost:9000/me-in-loo/posts/174.jpg,Brother very because ground again.,0
BarneyYearout333@gmail.com,http://localhost:9000/me-in-loo/posts/175.jpg,Soldier with current TV own mean list.,0
CharlesMarkus334@gmail.com,http://localhost:9000/me-in-loo/posts/176.jpg,None,0
EstherCampanelli335@gmail.com,None,Really teach room likely everything.,0
JohnathonJulius336@gmail.com,None,Probably surface third south.,0
HerbertIbarra337@gmail.com,http://localhost:9000/me-in-loo/posts/177.jpg,None,0
MaryMinyard338@gmail.com,http://localhost:9000/me-in-loo/posts/178.jpg,None,0
JohnMiscione339@gmail.com,http://localhost:9000/me-in-loo/posts/179.jpg,Once again choose hear indicate available space century.,0
BarbaraBillings340@gmail.com,http://localhost:9000/me-in-loo/posts/18.jpg,Space drop certain American thank.,0
ChesterMcdowell341@gmail.com,http://localhost:9000/me-in-loo/posts/180.jpg,How create item off couple entire.,0
MartinaLangton342@gmail.com,http://localhost:9000/me-in-loo/posts/181.jpg,None,0
RichardCohn343@gmail.com,http://localhost:9000/me-in-loo/posts/182.jpg,Writer throughout owner culture beat later be.,0
NormanCummings344@gmail.com,http://localhost:9000/me-in-loo/posts/183.jpg,Final subject participant huge.,0
CarrieCrowe345@gmail.com,None,Capital seat level scientist begin.,0
LeahHartline346@gmail.com,http://localhost:9000/me-in-loo/posts/184.jpg,Although long long fill check dark quite.,0
EdwardBailey347@gmail.com,http://localhost:9000/me-in-loo/posts/185.jpg,None,0
StephenMoffit348@gmail.com,http://localhost:9000/me-in-loo/posts/186.jpg,Measure government force politics.,0
DouglasHall349@gmail.com,http://localhost:9000/me-in-loo/posts/187.jpg,Figure become beautiful pay action ever.,0
RobertEdwards350@gmail.com,http://localhost:9000/me-in-loo/posts/188.jpg,None,0
MargaretLee351@gmail.com,None,None,0
AugustFrazier352@gmail.com,http://localhost:9000/me-in-loo/posts/189.jpg,Southern source scene specific carry place these.,0
SarahKeen353@gmail.com,http://localhost:9000/me-in-loo/posts/19.jpg,Agree main fly.,0
NatashaRomero354@gmail.com,None,Anyone either week reach movement value side somebody.,0
GaryTesmar355@gmail.com,http://localhost:9000/me-in-loo/posts/190.jpg,Tree mother very when world.,0
ThelmaPurtle356@gmail.com,None,Record officer today free see pick rule.,0
JuanBell357@gmail.com,http://localhost:9000/me-in-loo/posts/191.jpg,Writer region herself forget.,0
JoanBrooks358@gmail.com,None,Take analysis piece involve the generation.,0
TanikaBetton359@gmail.com,http://localhost:9000/me-in-loo/posts/192.jpg,Ever news site in.,0
JoyQuezada360@gmail.com,http://localhost:9000/me-in-loo/posts/193.jpg,Drop particular compare party.,0
StacyJones361@gmail.com,http://localhost:9000/me-in-loo/posts/194.jpg,Economy gun back spring single far themselves.,0
DonnieRobison362@gmail.com,http://localhost:9000/me-in-loo/posts/195.jpg,None,0
PaulDifranco363@gmail.com,http://localhost:9000/me-in-loo/posts/196.jpg,Firm goal of pattern foreign.,0
LoisJohnson364@gmail.com,http://localhost:9000/me-in-loo/posts/197.jpg,Over what easy say form next according.,0
KathySaucier365@gmail.com,http://localhost:9000/me-in-loo/posts/198.jpg,None,0
MaxineMurphy366@gmail.com,None,Significant may claim simple hair theory.,0
DavidScheffler367@gmail.com,None,Today attention off onto huge gas.,0
JacquelineClifford368@gmail.com,None,None,0
RicoMcdowell369@gmail.com,None,Employee teach actually suggest suffer.,0
AmandaThompkins370@gmail.com,http://localhost:9000/me-in-loo/posts/199.jpg,None,0
JackelineWilliams371@gmail.com,http://localhost:9000/me-in-loo/posts/2.jpg,Third soon form politics network.,0
JenniferRothstein372@gmail.com,None,None,0
JohnnieWade373@gmail.com,http://localhost:9000/me-in-loo/posts/20.jpg,Court trade it on nor almost you.,0
AlexandriaCser374@gmail.com,http://localhost:9000/me-in-loo/posts/200.jpg,Week green standard might officer enter somebody.,0
BrianJones375@gmail.com,http://localhost:9000/me-in-loo/posts/201.jpg,None,0
ElizabethBassett376@gmail.com,http://localhost:9000/me-in-loo/posts/202.jpg,None,0
RebaMathieu377@gmail.com,http://localhost:9000/me-in-loo/posts/203.jpg,Set draw future themselves white he simply.,0
AldenBalson378@gmail.com,http://localhost:9000/me-in-loo/posts/204.jpg,Authority skin have on.,0
ChristopherReyes379@gmail.com,http://localhost:9000/me-in-loo/posts/205.jpg,Senior require executive increase home.,0
LauraWhite380@gmail.com,http://localhost:9000/me-in-loo/posts/206.jpg,Research international now page kind religious production.,0
BarbaraKnox381@gmail.com,http://localhost:9000/me-in-loo/posts/207.jpg,Later size concern goal ability image.,0
KarlFernandez382@gmail.com,http://localhost:9000/me-in-loo/posts/208.jpg,System real religious special whom no radio else.,0
KimberlyApodaca383@gmail.com,http://localhost:9000/me-in-loo/posts/209.jpg,None,0
WilliamHulse384@gmail.com,None,Popular thing watch he next amount.,0
FrancesHarms385@gmail.com,None,None,0
CurtisGrant386@gmail.com,http://localhost:9000/me-in-loo/posts/21.jpg,Safe current build.,0
AntonioPuente387@gmail.com,http://localhost:9000/me-in-loo/posts/210.jpg,Home child per report scene indicate among history.,0
MorganHubert388@gmail.com,http://localhost:9000/me-in-loo/posts/211.jpg,Cut several need.,0
NormanZeiler389@gmail.com,http://localhost:9000/me-in-loo/posts/212.jpg,Trouble town spend shake next painting father.,0
RhodaRamirez390@gmail.com,http://localhost:9000/me-in-loo/posts/213.jpg,West research challenge police well expert.,0
AndersonWallace391@gmail.com,http://localhost:9000/me-in-loo/posts/214.jpg,Break name during somebody page official.,0
ErlindaStarzyk392@gmail.com,http://localhost:9000/me-in-loo/posts/215.jpg,Nice police indeed industry father.,0
TonyaWilson393@gmail.com,None,Mrs ask act five happen small agency.,0
LauraGonzales394@gmail.com,http://localhost:9000/me-in-loo/posts/216.jpg,None,0
JohnMcdonald395@gmail.com,http://localhost:9000/me-in-loo/posts/217.jpg,None,0
BonnieLang396@gmail.com,http://localhost:9000/me-in-loo/posts/218.jpg,Outside describe seek win.,0
MarjorieVanorden397@gmail.com,None,Structure though foreign send.,0
DavidContreras398@gmail.com,None,None,0
AgnesGaston399@gmail.com,None,Guess former hotel build.,0
DannyMetevier400@gmail.com,None,None,0
AlfredSmalls401@gmail.com,None,None,0
WilburStorey402@gmail.com,http://localhost:9000/me-in-loo/posts/219.jpg,None,0
JanSabella403@gmail.com,None,Friend something share onto name.,0
MelissaAbbott404@gmail.com,None,None,0
WilliamHoltzclaw405@gmail.com,http://localhost:9000/me-in-loo/posts/22.jpg,Member course thing technology me case.,0
JamesManning406@gmail.com,http://localhost:9000/me-in-loo/posts/220.jpg,None,0
QueenRobinson407@gmail.com,http://localhost:9000/me-in-loo/posts/221.jpg,Court chance civil control type land.,0
GabrielleCincotta408@gmail.com,http://localhost:9000/me-in-loo/posts/222.jpg,Whatever despite subject lay tough tax.,0
DorothyNovak409@gmail.com,None,Option night list billion scientist others would stand.,0
LorettaCyr410@gmail.com,http://localhost:9000/me-in-loo/posts/223.jpg,Will well war local forward resource notice.,0
JosephineHauser411@gmail.com,http://localhost:9000/me-in-loo/posts/224.jpg,Care green successful few.,0
JosefinaAkin412@gmail.com,http://localhost:9000/me-in-loo/posts/225.jpg,Economy professor ground debate animal area.,0
JohannaJones413@gmail.com,None,End building account thing summer human policy.,0
EbonyCotter414@gmail.com,None,Official soon ever statement raise relate really plan.,0
BretStarrick415@gmail.com,None,Condition again hold.,0
ElianaVaughn416@gmail.com,http://localhost:9000/me-in-loo/posts/226.jpg,None,0
RooseveltMason417@gmail.com,http://localhost:9000/me-in-loo/posts/227.jpg,Mind either room kind imagine identify manage.,0
IreneColon418@gmail.com,http://localhost:9000/me-in-loo/posts/228.jpg,Well whose the tax water standard race.,0
ChristopherHolsapple419@gmail.com,None,None,0
JoeHolt420@gmail.com,http://localhost:9000/me-in-loo/posts/229.jpg,Play Mr type this.,0
LaurieSmith421@gmail.com,http://localhost:9000/me-in-loo/posts/23.jpg,None,0
LynneMoore422@gmail.com,None,None,0
PeteOlson423@gmail.com,None,Shoulder both after stop fly.,0
AdrianJohnson424@gmail.com,http://localhost:9000/me-in-loo/posts/230.jpg,Tend service we there.,0
DebraWest425@gmail.com,http://localhost:9000/me-in-loo/posts/231.jpg,Carry charge also them.,0
LawrenceQuella426@gmail.com,http://localhost:9000/me-in-loo/posts/232.jpg,None,0
JoanSerra427@gmail.com,None,None,0
ClydePetty428@gmail.com,http://localhost:9000/me-in-loo/posts/233.jpg,Shake activity believe because wear prevent cold staff.,0
CherriEccleston429@gmail.com,http://localhost:9000/me-in-loo/posts/234.jpg,Daughter commercial how perhaps boy.,0
MatthewManuel430@gmail.com,http://localhost:9000/me-in-loo/posts/235.jpg,Affect lawyer or system himself.,0
ColleenSmith431@gmail.com,http://localhost:9000/me-in-loo/posts/236.jpg,None,0
BruceNewberg432@gmail.com,http://localhost:9000/me-in-loo/posts/237.jpg,None,0
AnnJones433@gmail.com,http://localhost:9000/me-in-loo/posts/238.jpg,None,0
TedWest434@gmail.com,http://localhost:9000/me-in-loo/posts/239.jpg,Away record read one into.,0
ManuelDiamond435@gmail.com,None,Century then surface because can finish probably their.,0
MichelleElston436@gmail.com,None,Particular our matter year letter various participant.,0
GuadalupePrince437@gmail.com,None,Pressure spring traditional discuss.,0
WilliamAngle438@gmail.com,None,Mean right manage.,0
BarrettFrerichs439@gmail.com,None,None,0
EllenFranks440@gmail.com,http://localhost:9000/me-in-loo/posts/24.jpg,Nice only customer group.,0
HaroldMiller441@gmail.com,http://localhost:9000/me-in-loo/posts/240.jpg,Admit body reflect avoid summer already attack.,0
DavidJennings442@gmail.com,None,Minute baby walk modern.,0
JustinCook443@gmail.com,None,None,0
BrianFerris444@gmail.com,None,Office wonder follow right ok child all.,0
GertrudeGorsuch445@gmail.com,http://localhost:9000/me-in-loo/posts/241.jpg,None,0
AveryRamsey446@gmail.com,http://localhost:9000/me-in-loo/posts/242.jpg,Court range us season great material gun collection.,0
SonyaStreet447@gmail.com,http://localhost:9000/me-in-loo/posts/243.jpg,Particularly attorney pattern case energy.,0
StellaHix448@gmail.com,http://localhost:9000/me-in-loo/posts/244.jpg,Again article rate yes.,0
BobSchlichter449@gmail.com,http://localhost:9000/me-in-loo/posts/245.jpg,Protect society enjoy line.,0
KennethArnold450@gmail.com,http://localhost:9000/me-in-loo/posts/246.jpg,None,0
LillianRodriguez451@gmail.com,http://localhost:9000/me-in-loo/posts/247.jpg,Can few member and player enjoy tell.,0
HannahToyoshima452@gmail.com,None,None,0
JustinGreer453@gmail.com,None,None,0
JeanineTodd454@gmail.com,http://localhost:9000/me-in-loo/posts/248.jpg,Contain ability against low people interesting.,0
PeggyEstes455@gmail.com,None,Organization on morning spend.,0
DiegoBailey456@gmail.com,http://localhost:9000/me-in-loo/posts/249.jpg,Suffer play easy short.,0
ThomasCrump457@gmail.com,http://localhost:9000/me-in-loo/posts/25.jpg,Perhaps tonight country.,0
MichaelRamirez458@gmail.com,None,Development because operation picture two.,0
BobbyMyer459@gmail.com,http://localhost:9000/me-in-loo/posts/250.jpg,Box other return really church member.,0
WalterRosales460@gmail.com,http://localhost:9000/me-in-loo/posts/251.jpg,Point provide walk mind.,0
AmySmith461@gmail.com,http://localhost:9000/me-in-loo/posts/252.jpg,None,0
ClaudiaMcdaniel462@gmail.com,http://localhost:9000/me-in-loo/posts/253.jpg,With any customer nice behind item.,0
JohnPope463@gmail.com,http://localhost:9000/me-in-loo/posts/254.jpg,None,0
MichaelWilliams464@gmail.com,http://localhost:9000/me-in-loo/posts/255.jpg,Go whose chance add do time site.,0
DarleneCastillo465@gmail.com,http://localhost:9000/me-in-loo/posts/256.jpg,Late sense least most ever.,0
LucyCobb466@gmail.com,http://localhost:9000/me-in-loo/posts/257.jpg,None,0
MatthewMoore467@gmail.com,None,None,0
MichaelHan468@gmail.com,http://localhost:9000/me-in-loo/posts/258.jpg,Drop rule know subject ever.,0
ShelleyMalaspina469@gmail.com,http://localhost:9000/me-in-loo/posts/259.jpg,None,0
AaronGatson470@gmail.com,http://localhost:9000/me-in-loo/posts/26.jpg,Pm word cold.,0
MaryFoster471@gmail.com,None,Southern learn beyond someone leg.,0
AnnHudson472@gmail.com,http://localhost:9000/me-in-loo/posts/260.jpg,Front word term buy.,0
RobertParker473@gmail.com,http://localhost:9000/me-in-loo/posts/261.jpg,Begin Democrat animal wonder cold owner.,0
ChariseWellman474@gmail.com,http://localhost:9000/me-in-loo/posts/262.jpg,None,0
RogerSchroeder475@gmail.com,http://localhost:9000/me-in-loo/posts/263.jpg,Make game look compare describe everybody.,0
AubreyEason476@gmail.com,None,Especially draw range condition option.,0
JefferyHughes477@gmail.com,None,Sit American word to agent minute.,0
TroyGolden478@gmail.com,None,Price stop ok history method.,0
KeithKennedy479@gmail.com,None,Call investment ever cold election.,0
JaneJenkins480@gmail.com,http://localhost:9000/me-in-loo/posts/264.jpg,Capital arrive radio.,0
LorraineKerr481@gmail.com,None,None,0
CraigColeman482@gmail.com,http://localhost:9000/me-in-loo/posts/265.jpg,None,0
HeatherSoders483@gmail.com,http://localhost:9000/me-in-loo/posts/266.jpg,Few behind prove daughter rather model receive.,0
ChloeDobkin484@gmail.com,None,Which deal test.,0
RobertCrockett485@gmail.com,http://localhost:9000/me-in-loo/posts/267.jpg,None,0
MargieRussell486@gmail.com,http://localhost:9000/me-in-loo/posts/268.jpg,None,0
MichaelLewis487@gmail.com,None,Director outside food campaign.,0
HerbertMulloy488@gmail.com,http://localhost:9000/me-in-loo/posts/269.jpg,None,0
HelenSegura489@gmail.com,None,Number type nothing middle meeting risk side.,0
AnnPinson490@gmail.com,None,Worker brother stay power project prepare home.,0
DavidLentz491@gmail.com,None,None,0
FrankLynch492@gmail.com,http://localhost:9000/me-in-loo/posts/27.jpg,Perform think event fall everything group.,0
HerbertSmitherman493@gmail.com,http://localhost:9000/me-in-loo/posts/270.jpg,Message city truth son white account crime.,0
DanielHackett494@gmail.com,http://localhost:9000/me-in-loo/posts/271.jpg,Face fly behavior prove such.,0
TomasSnow495@gmail.com,None,None,0
DannyWadsworth496@gmail.com,http://localhost:9000/me-in-loo/posts/272.jpg,None,0
EthelHatala497@gmail.com,http://localhost:9000/me-in-loo/posts/273.jpg,Result health shoulder decade order.,0
BrentSerrata498@gmail.com,http://localhost:9000/me-in-loo/posts/274.jpg,None,0
TommieJackson499@gmail.com,http://localhost:9000/me-in-loo/posts/275.jpg,Piece small feeling perform hear Congress hear.,0
ClaraHarkness500@gmail.com,None,None,0
MattGuzman501@gmail.com,http://localhost:9000/me-in-loo/posts/276.jpg,Value fill thank city today similar.,0
JackGarey502@gmail.com,http://localhost:9000/me-in-loo/posts/277.jpg,None,0
WalterNeff503@gmail.com,http://localhost:9000/me-in-loo/posts/278.jpg,Speech read politics past long.,0
FredBlack504@gmail.com,http://localhost:9000/me-in-loo/posts/279.jpg,Far media receive base both create last.,0
EmeryRasmussen505@gmail.com,http://localhost:9000/me-in-loo/posts/28.jpg,Then receive want yet yeah report.,0
GuillerminaFriend506@gmail.com,http://localhost:9000/me-in-loo/posts/280.jpg,Marriage race show process despite.,0
DavidRamos507@gmail.com,http://localhost:9000/me-in-loo/posts/281.jpg,None,0
KevinPerry508@gmail.com,http://localhost:9000/me-in-loo/posts/282.jpg,Maintain anything often standard friend house.,0
DavidWalters509@gmail.com,http://localhost:9000/me-in-loo/posts/283.jpg,None,0
EdwardDupre510@gmail.com,http://localhost:9000/me-in-loo/posts/284.jpg,Space heart talk hair just.,0
TroyThompson511@gmail.com,http://localhost:9000/me-in-loo/posts/285.jpg,None,0
EmmittQualls512@gmail.com,http://localhost:9000/me-in-loo/posts/286.jpg,Commercial we kind degree cup take same series.,0
CaroleSandoval513@gmail.com,http://localhost:9000/me-in-loo/posts/287.jpg,Special rich room position think true official.,0
AnnMoore514@gmail.com,http://localhost:9000/me-in-loo/posts/288.jpg,Subject television have whose himself pressure with address.,0
TrevorWildman515@gmail.com,None,Country new walk project notice.,0
SandraBillings516@gmail.com,http://localhost:9000/me-in-loo/posts/289.jpg,Look fear page director blue try occur firm.,0
JenniferPlescia517@gmail.com,http://localhost:9000/me-in-loo/posts/29.jpg,Culture change above fall girl true defense.,0
RubyPye518@gmail.com,http://localhost:9000/me-in-loo/posts/290.jpg,Exist treat along him morning themselves.,0
KristopherMunoz519@gmail.com,http://localhost:9000/me-in-loo/posts/291.jpg,Argue draw control five price national these.,0
MarthaBufkin520@gmail.com,http://localhost:9000/me-in-loo/posts/292.jpg,Force morning wish some suggest less.,0
PaulMashburn521@gmail.com,http://localhost:9000/me-in-loo/posts/293.jpg,None,0
SylvesterBowmer522@gmail.com,http://localhost:9000/me-in-loo/posts/294.jpg,Task ball edge same.,0
LarryMiller523@gmail.com,http://localhost:9000/me-in-loo/posts/295.jpg,Head car last up represent.,0
LorrieStevens524@gmail.com,http://localhost:9000/me-in-loo/posts/296.jpg,Leg hot campaign card nation when.,0
LarryLovelace525@gmail.com,http://localhost:9000/me-in-loo/posts/297.jpg,Professor church party appear we meeting position.,0
BerniceBonaccorsi526@gmail.com,http://localhost:9000/me-in-loo/posts/298.jpg,None,0
RonaldWilliams527@gmail.com,http://localhost:9000/me-in-loo/posts/299.jpg,None,0
BettieLumpkin528@gmail.com,http://localhost:9000/me-in-loo/posts/3.jpg,Among since red about.,0
JohnColon529@gmail.com,None,Difficult nothing throw during stay country process.,0
MargaretCockrell530@gmail.com,http://localhost:9000/me-in-loo/posts/30.jpg,Think study last along.,0
CeciliaDemello531@gmail.com,http://localhost:9000/me-in-loo/posts/300.jpg,Today weight church push necessary audience.,0
MirellaReighard532@gmail.com,http://localhost:9000/me-in-loo/posts/301.jpg,End interest heavy heart wall too develop.,0
SheliaPatterson533@gmail.com,http://localhost:9000/me-in-loo/posts/302.jpg,Think shake political movie.,0
JerilynJacobs534@gmail.com,None,Mother Democrat way industry result life ever.,0
BrettJones535@gmail.com,http://localhost:9000/me-in-loo/posts/303.jpg,Support commercial appear take enter thousand.,0
JamieMitchell536@gmail.com,None,Trade war beat today kitchen ago ten various.,0
ScottWillhite537@gmail.com,None,None,0
CassieGarcia538@gmail.com,None,Forget concern win cause talk effort of.,0
FrankWilliams539@gmail.com,http://localhost:9000/me-in-loo/posts/304.jpg,Recognize change list data agency.,0
JerryClarke540@gmail.com,None,None,0
WilberDole541@gmail.com,http://localhost:9000/me-in-loo/posts/305.jpg,None,0
ChrisGraybill542@gmail.com,http://localhost:9000/me-in-loo/posts/306.jpg,None,0
MaryScerra543@gmail.com,None,Oil where read.,0
MarvinKoch544@gmail.com,http://localhost:9000/me-in-loo/posts/307.jpg,All allow read ground those many start class.,0
CarlosRushing545@gmail.com,None,None,0
MichelleMcconnell546@gmail.com,None,None,0
HelenPitcock547@gmail.com,http://localhost:9000/me-in-loo/posts/308.jpg,None,0
JohnParker548@gmail.com,http://localhost:9000/me-in-loo/posts/309.jpg,She worry century take.,0
KatiKamal549@gmail.com,None,Light cause matter process tend kitchen.,0
WillieRamsay550@gmail.com,http://localhost:9000/me-in-loo/posts/31.jpg,Professor sport today turn charge free amount.,0
JudyJones551@gmail.com,http://localhost:9000/me-in-loo/posts/310.jpg,Road discuss drop light likely.,0
LorindaBrase552@gmail.com,http://localhost:9000/me-in-loo/posts/311.jpg,Its building woman pattern bad human usually.,0
AlbertStadler553@gmail.com,http://localhost:9000/me-in-loo/posts/312.jpg,Season tax indicate find clear behavior appear center.,0
DanielRodriguez554@gmail.com,http://localhost:9000/me-in-loo/posts/313.jpg,Face long whose.,0
RayPerlman555@gmail.com,None,None,0
LeslieRevis556@gmail.com,http://localhost:9000/me-in-loo/posts/314.jpg,Participant decision hundred strong civil direction wonder somebody.,0
ArthurRegan557@gmail.com,http://localhost:9000/me-in-loo/posts/315.jpg,Carry dinner instead yes forward again.,0
JuanParks558@gmail.com,http://localhost:9000/me-in-loo/posts/316.jpg,Military able each crime sit.,0
AntwanThompson559@gmail.com,None,Leg want candidate simply make bank.,0
SterlingChobot560@gmail.com,None,Rate stand stuff late mention environment window.,0
AngelaNieman561@gmail.com,http://localhost:9000/me-in-loo/posts/317.jpg,None,0
SharonTate562@gmail.com,http://localhost:9000/me-in-loo/posts/318.jpg,None,0
JulianaMayo563@gmail.com,None,Above stuff light democratic.,0
StanleyEck564@gmail.com,None,Cell threat including sister reflect.,0
JaneBadanguio565@gmail.com,http://localhost:9000/me-in-loo/posts/319.jpg,Garden room doctor upon.,0
MelissaJensen566@gmail.com,http://localhost:9000/me-in-loo/posts/32.jpg,We computer way.,0
LouisDonovan567@gmail.com,None,Set article war.,0
WilliamTerry568@gmail.com,http://localhost:9000/me-in-loo/posts/320.jpg,None,0
EvaFrancis569@gmail.com,http://localhost:9000/me-in-loo/posts/321.jpg,None,0
EdwardMcleod570@gmail.com,http://localhost:9000/me-in-loo/posts/322.jpg,Building stock boy month measure treat commercial.,0
EssieHageman571@gmail.com,http://localhost:9000/me-in-loo/posts/323.jpg,None,0
AndreaHavir572@gmail.com,http://localhost:9000/me-in-loo/posts/324.jpg,Exactly support nature stuff former sure lead total.,0
AlisaBright573@gmail.com,http://localhost:9000/me-in-loo/posts/325.jpg,Finally effect never offer.,0
JamesWhite574@gmail.com,http://localhost:9000/me-in-loo/posts/326.jpg,Wall agency speak sea shoulder near.,0
TammyBlevins575@gmail.com,http://localhost:9000/me-in-loo/posts/327.jpg,None,0
ClarenceLeland576@gmail.com,None,Money six professional although specific image.,0
