WilliamAllan1@gmail.com,http://localhost:9000/me-in-loo/meme/02574f2d-5e85-4348-bfcb-07971f695732.jpg,None,1
EvaWilliams2@gmail.com,http://localhost:9000/me-in-loo/meme/06bfd16a-522d-4f13-9120-a6e63ea9589c.jpg,American whole magazine truth stop whose.,1
ChristopherClark3@gmail.com,http://localhost:9000/me-in-loo/meme/2bf07986-e7c4-429b-ae39-2a04c5b5995d.jpg,Financial role together range.,0
MarthaDehart4@gmail.com,http://localhost:9000/me-in-loo/meme/2c80ccfc-507f-4bf9-bdaf-fdf0c24a0397.jpg,Beyond its particularly tree whom local tend.,0
VivianWarren5@gmail.com,http://localhost:9000/me-in-loo/meme/39d164ca-842a-4e9e-bb27-9aa530955f50.jpg,Source nature add rest.,0
StephaniePribbenow6@gmail.com,None,Ability management test during foot that course nothing.,0
RobertBiggs7@gmail.com,None,Sort language ball floor.,3
VickiPockrus8@gmail.com,None,Theory type successful together.,1
DarleneCooper9@gmail.com,None,Study modern miss dog Democrat quickly.,1
TanyaJames10@gmail.com,http://localhost:9000/me-in-loo/meme/46ae34e1-8d89-4d00-8c00-5e8d98a25e1e.jpg,Fire happen nothing support suffer which parent.,4
KimberlyMunoz11@gmail.com,None,Policy head Mrs debate onto across character.,1
SalvadorRamsey12@gmail.com,http://localhost:9000/me-in-loo/meme/472c55a7-5064-492b-9353-e31f3edc6856.jpg,Smile responsibility full per among clearly.,4
WoodrowTaylor13@gmail.com,http://localhost:9000/me-in-loo/meme/4ee00803-1b92-4f20-980c-6f15cf8659e6.jpg,Guess writer can boy room.,3
JenniferHarris14@gmail.com,None,Conference mission audience idea foreign.,2
KimberlyHammack15@gmail.com,http://localhost:9000/me-in-loo/meme/505a5a71-37ac-4b41-89eb-1fa1c4c29ae8.jpg,Feel serve large.,2
MichaelOrtiz16@gmail.com,http://localhost:9000/me-in-loo/meme/56c13d82-2437-4068-8824-71a8b107c401.jpg,Teacher wall field impact special artist political.,0
JessicaWiseman17@gmail.com,http://localhost:9000/me-in-loo/meme/57cca5e5-fa61-4054-8884-74a60df78ff3.jpg,None,1
LettieDuffy18@gmail.com,http://localhost:9000/me-in-loo/meme/5f260a74-1c31-47a3-9d58-ace4edc6fde0.jpg,Question set discussion seven.,0
EarlCarter19@gmail.com,None,Worker building this American either moment ok how.,0
BenjaminJones20@gmail.com,http://localhost:9000/me-in-loo/meme/628849eb-e179-4ed2-9529-b0e64d162715.jpg,None,3
JanetGibson21@gmail.com,http://localhost:9000/me-in-loo/meme/73bb2171-99a7-4b39-98b8-6f192a223d7a.jpg,None,0
MarkBrownlee22@gmail.com,None,None,1
SheldonDupre23@gmail.com,http://localhost:9000/me-in-loo/meme/75b85faa-05ec-402c-8af3-b021994c47ee.jpg,Road dinner seem explain black.,0
EleanorJones24@gmail.com,http://localhost:9000/me-in-loo/meme/8d29fc1f-050a-47d0-95fc-078c544cd4ae.jpg,None,0
MelanieMyers25@gmail.com,http://localhost:9000/me-in-loo/meme/a781c7c0-0070-44d8-8520-b51b4139b888.jpg,None,0
ClarenceHopkins26@gmail.com,http://localhost:9000/me-in-loo/meme/a8840ddc-a5ee-49a2-be3b-4b1ca856173f.jpg,None,0
OrvilleFairey27@gmail.com,None,None,0
EvanBishop28@gmail.com,http://localhost:9000/me-in-loo/meme/abdd3db9-935c-4bb6-a463-2aa62b3d6047.jpg,Himself former possible reach challenge value.,78
JessicaLevy29@gmail.com,http://localhost:9000/me-in-loo/meme/b00ddf88-c620-418e-af26-cddd17f2e54a.jpg,World win product election baby.,4
EdithRabon30@gmail.com,http://localhost:9000/me-in-loo/meme/b1369643-1db3-49ce-90a7-f9a6eddef26a.jpg,None,2
AmeliaBurgess31@gmail.com,http://localhost:9000/me-in-loo/meme/bad0c435-3cdb-464e-9a42-0b7648b5017e.jpg,Be financial plan phone step country article.,4
BeverlyGonzales32@gmail.com,None,None,1
DanielPrinty33@gmail.com,None,Stay soon account part wind well thousand.,2
DaleSproles34@gmail.com,http://localhost:9000/me-in-loo/meme/c1ff6aa4-ead3-4a44-ad6e-eded94170ed6.jpg,Six loss agree place cell reflect.,0
WilliamRivera35@gmail.com,http://localhost:9000/me-in-loo/meme/c345580d-e8eb-470a-80e2-68299a9996ae.jpg,Any include try agree out.,4
LisaBradford36@gmail.com,http://localhost:9000/me-in-loo/meme/d9c42a95-1006-438c-a290-e9c752d60d5a.jpg,Learn economy explain main sport summer sea.,2
ClaytonMcwaters37@gmail.com,http://localhost:9000/me-in-loo/meme/db4d140d-62d2-40db-85a9-3f6cd4bf285b.jpg,None,2
DanaRoblez38@gmail.com,http://localhost:9000/me-in-loo/meme/e877070b-f55a-4f92-8721-49240b971e7f.jpg,Tell boy arrive.,0
ChanellScheppke39@gmail.com,http://localhost:9000/me-in-loo/meme/e8b653bd-5d7c-4782-898a-0df3714c229d.jpg,Past next final tonight table.,2
KarenLandstrom40@gmail.com,http://localhost:9000/me-in-loo/meme/f47a4c3e-df24-4b18-98f9-134a0af610f3.jpg,Detail put risk yet so before.,0
CatherineMiller41@gmail.com,http://localhost:9000/me-in-loo/posts/0.jpg,Message western stage yes too dog among believe.,1
CarolMann42@gmail.com,None,Current open goal probably.,1
JamesAbraham43@gmail.com,None,Bank result peace reality evidence.,3
JasonRangel44@gmail.com,http://localhost:9000/me-in-loo/posts/1.jpg,About century debate officer about.,111
StephanyMonroe45@gmail.com,http://localhost:9000/me-in-loo/posts/10.jpg,None,2
NormanBagley46@gmail.com,None,Space store community.,3
MichaelAmes47@gmail.com,http://localhost:9000/me-in-loo/posts/100.jpg,Reason make knowledge during whom.,5
EstellaHarding48@gmail.com,http://localhost:9000/me-in-loo/posts/1000.jpg,Throughout statement like responsibility career season.,3
MarionGreen49@gmail.com,http://localhost:9000/me-in-loo/posts/1001.jpg,Hospital capital others majority something.,1
PatriciaLabay50@gmail.com,http://localhost:9000/me-in-loo/posts/1002.jpg,None,3
CyrusFebres51@gmail.com,http://localhost:9000/me-in-loo/posts/1003.jpg,None,2
KarinGomez52@gmail.com,http://localhost:9000/me-in-loo/posts/1004.jpg,Radio not account land why thought.,3
EvelynColeman53@gmail.com,None,Still beyond Congress television never discuss.,0
ClarenceBarga54@gmail.com,None,None,3
PamelaCummins55@gmail.com,None,Hundred anything morning surface the.,3
ShermanDuncan56@gmail.com,None,Discuss ask team maybe future stay rich.,0
JosephRice57@gmail.com,http://localhost:9000/me-in-loo/posts/1005.jpg,Its factor herself sea worker store successful.,3
LettieLewis58@gmail.com,http://localhost:9000/me-in-loo/posts/1006.jpg,None,0
VickyMurphy59@gmail.com,http://localhost:9000/me-in-loo/posts/1007.jpg,None,1
BrendaBurke60@gmail.com,http://localhost:9000/me-in-loo/posts/1008.jpg,World police space specific.,0
JeanCervantes61@gmail.com,None,Hope current page.,2
MikeFortner62@gmail.com,None,Kid feeling moment.,0
JamesStephens63@gmail.com,http://localhost:9000/me-in-loo/posts/1009.jpg,Space wife present although president across human.,3
DavidShafer64@gmail.com,None,Where close democratic body my behind design.,3
MaryFuller65@gmail.com,http://localhost:9000/me-in-loo/posts/101.jpg,Focus discuss our five purpose everything.,2
NaomiPetrocco66@gmail.com,http://localhost:9000/me-in-loo/posts/1010.jpg,System involve require region.,134
JamesSchulz67@gmail.com,None,Adult possible six life see.,3
DesmondVierk68@gmail.com,http://localhost:9000/me-in-loo/posts/1011.jpg,None,1
BrianDitullio69@gmail.com,http://localhost:9000/me-in-loo/posts/1012.jpg,Surface TV it ask information.,0
AlfredTravis70@gmail.com,http://localhost:9000/me-in-loo/posts/1013.jpg,Adult family story yet occur.,1
NathanielHampton71@gmail.com,None,None,0
ChristopherFarrell72@gmail.com,None,None,1
ElizabethBlackmon73@gmail.com,http://localhost:9000/me-in-loo/posts/1014.jpg,Reach risk painting camera film leave.,2
BritneySpoor74@gmail.com,http://localhost:9000/me-in-loo/posts/1015.jpg,Film leader edge clearly voice.,0
TerresaEvans75@gmail.com,None,American need outside who respond plant environmental time.,3
TyraBuchanan76@gmail.com,http://localhost:9000/me-in-loo/posts/1016.jpg,Particularly behavior north discuss respond today method.,1
JamesFerris77@gmail.com,http://localhost:9000/me-in-loo/posts/1017.jpg,Young against wish where Mrs above husband.,0
PeggyDefalco78@gmail.com,None,None,0
PhillipLevels79@gmail.com,None,Reason act left hundred site should keep.,0
JosephSloan80@gmail.com,http://localhost:9000/me-in-loo/posts/1018.jpg,Technology avoid less food study hit brother.,1
GraceKerr81@gmail.com,http://localhost:9000/me-in-loo/posts/1019.jpg,His participant nation institution.,3
HaroldGraham82@gmail.com,http://localhost:9000/me-in-loo/posts/102.jpg,Necessary treat model build skin stuff.,0
LucasDurbin83@gmail.com,http://localhost:9000/me-in-loo/posts/1020.jpg,Until across must father hope kid.,0
LatoyaGiles84@gmail.com,None,None,0
DanaHam85@gmail.com,None,None,1
ColumbusFurtado86@gmail.com,http://localhost:9000/me-in-loo/posts/1021.jpg,Space live measure agree guy star.,3
ShelleyHefner87@gmail.com,http://localhost:9000/me-in-loo/posts/1022.jpg,Issue everyone camera drug partner.,1
AmandaHawk88@gmail.com,http://localhost:9000/me-in-loo/posts/1023.jpg,Nearly drop quickly network.,0
LarryFord89@gmail.com,http://localhost:9000/me-in-loo/posts/1024.jpg,Dream determine action why seem too laugh.,0
WilliamBradley90@gmail.com,http://localhost:9000/me-in-loo/posts/1025.jpg,Believe project resource floor mouth possible kitchen.,1
WesleyHerring91@gmail.com,None,Easy environment heart hot Congress.,0
JosephThoma92@gmail.com,http://localhost:9000/me-in-loo/posts/1026.jpg,None,0
DavidHulbert93@gmail.com,http://localhost:9000/me-in-loo/posts/1027.jpg,None,1
StevenLudwick94@gmail.com,http://localhost:9000/me-in-loo/posts/1028.jpg,None,2
DorothyGoolesby95@gmail.com,http://localhost:9000/me-in-loo/posts/1029.jpg,Energy defense tax discuss according structure follow attention.,0
RyanCole96@gmail.com,None,None,2
ElizabethVerduzco97@gmail.com,http://localhost:9000/me-in-loo/posts/103.jpg,Late manager ever quality dark tough.,3
JefferyPhillips98@gmail.com,http://localhost:9000/me-in-loo/posts/1030.jpg,Education because some son yeah.,0
ChristopherGorski99@gmail.com,None,These which sign politics enter enough knowledge.,5
SusannaBauer100@gmail.com,http://localhost:9000/me-in-loo/posts/1031.jpg,Exist page school another sell.,3
NancyTheden101@gmail.com,http://localhost:9000/me-in-loo/posts/1032.jpg,Believe save simply some.,3
JosephBacker102@gmail.com,None,Effort actually skin enter fight worry.,3
MildredReale103@gmail.com,http://localhost:9000/me-in-loo/posts/1033.jpg,Foot night tell blue front.,0
MaryReagan104@gmail.com,http://localhost:9000/me-in-loo/posts/1034.jpg,Source project family always.,3
MildredBrown105@gmail.com,None,None,3
VeraBeasley106@gmail.com,None,Choice stand baby.,0
TimothySwilling107@gmail.com,None,Movement interesting seat language Mrs raise black.,2
AnneFiedler108@gmail.com,http://localhost:9000/me-in-loo/posts/1035.jpg,None,0
AndrewRouleau109@gmail.com,None,Gas personal this certainly.,2
TheresaDeal110@gmail.com,None,Sign economic experience above education.,0
FlorenceGilmartin111@gmail.com,http://localhost:9000/me-in-loo/posts/1036.jpg,Walk actually continue number imagine candidate seem kind.,0
RafaelHuffman112@gmail.com,http://localhost:9000/me-in-loo/posts/1037.jpg,Road wind provide quickly low even.,2
NormanHemenway113@gmail.com,http://localhost:9000/me-in-loo/posts/1038.jpg,None,0
OctaviaColeman114@gmail.com,http://localhost:9000/me-in-loo/posts/1039.jpg,Country wish want amount maybe figure.,0
GloriaJohnson115@gmail.com,http://localhost:9000/me-in-loo/posts/104.jpg,Watch argue cold.,2
BriannaReinert116@gmail.com,http://localhost:9000/me-in-loo/posts/1040.jpg,Idea edge response cultural lot player.,0
RichardSmith117@gmail.com,None,Air senior challenge event.,0
KevinGatlin118@gmail.com,http://localhost:9000/me-in-loo/posts/1041.jpg,Produce if prove but strong key program because.,3
EllisStephen119@gmail.com,None,None,3
MelindaBernard120@gmail.com,http://localhost:9000/me-in-loo/posts/1042.jpg,None,0
JasonPerales121@gmail.com,http://localhost:9000/me-in-loo/posts/1043.jpg,Be certainly property mean approach example.,3
KathleenLee122@gmail.com,http://localhost:9000/me-in-loo/posts/1044.jpg,None,5
FlorenceMorton123@gmail.com,http://localhost:9000/me-in-loo/posts/1045.jpg,Level stuff back.,0
JeffreyBachtold124@gmail.com,http://localhost:9000/me-in-loo/posts/1046.jpg,None,3
MarkStanton125@gmail.com,http://localhost:9000/me-in-loo/posts/1047.jpg,None,2
MatthewDowling126@gmail.com,http://localhost:9000/me-in-loo/posts/1048.jpg,Firm fish onto anyone.,0
DanielDeisher127@gmail.com,None,None,0
SallyBrown128@gmail.com,http://localhost:9000/me-in-loo/posts/1049.jpg,Majority often usually rate foreign long medical.,0
KentGodwin129@gmail.com,http://localhost:9000/me-in-loo/posts/105.jpg,Career various ready really girl sure.,118
BlaineBrooks130@gmail.com,http://localhost:9000/me-in-loo/posts/1050.jpg,None,4
LoriChristion131@gmail.com,None,Tend art people physical.,3
ValarieHarton132@gmail.com,http://localhost:9000/me-in-loo/posts/1051.jpg,None,0
JavierDunnaway133@gmail.com,http://localhost:9000/me-in-loo/posts/1052.jpg,Get from land population fly season.,0
MargueriteDolan134@gmail.com,http://localhost:9000/me-in-loo/posts/1053.jpg,Piece value education student line what.,0
MarlaLewis135@gmail.com,http://localhost:9000/me-in-loo/posts/1054.jpg,None,0
DarrenCoffey136@gmail.com,http://localhost:9000/me-in-loo/posts/1055.jpg,None,3
MathewCallaghan137@gmail.com,http://localhost:9000/me-in-loo/posts/1056.jpg,None,2
DouglasKut138@gmail.com,None,Determine population power them authority attorney audience.,3
LindaWard139@gmail.com,http://localhost:9000/me-in-loo/posts/1057.jpg,None,4
FrankIsrael140@gmail.com,http://localhost:9000/me-in-loo/posts/1058.jpg,They join century old.,0
DavidMiller141@gmail.com,http://localhost:9000/me-in-loo/posts/1059.jpg,None,0
SimonRosboril142@gmail.com,http://localhost:9000/me-in-loo/posts/106.jpg,None,3
DannyReynolds143@gmail.com,None,Tax relationship determine on follow.,0
AngelaAndrus144@gmail.com,http://localhost:9000/me-in-loo/posts/1060.jpg,Hope action share make.,3
PhyllisHobbs145@gmail.com,None,None,5
JohnPerez146@gmail.com,http://localhost:9000/me-in-loo/posts/1061.jpg,Particular describe help true.,1
DonnaPhillips147@gmail.com,http://localhost:9000/me-in-loo/posts/1062.jpg,None,2
SalvatoreWallace148@gmail.com,None,On shoulder behavior purpose nor oil.,0
WilliamPerrotti149@gmail.com,None,Building reduce pass gun choose single.,0
LaurieSuttee150@gmail.com,http://localhost:9000/me-in-loo/posts/1063.jpg,Need fly north much drive report level.,2
BethanieMackay151@gmail.com,http://localhost:9000/me-in-loo/posts/1064.jpg,Doctor above national experience soon tree work.,2
StephanieLewis152@gmail.com,None,None,0
DorisLane153@gmail.com,None,College next son impact ask.,0
AngelaHux154@gmail.com,http://localhost:9000/me-in-loo/posts/1065.jpg,Cell contain bring.,2
WilliamGuererro155@gmail.com,http://localhost:9000/me-in-loo/posts/1066.jpg,Accept discuss leave political pressure.,0
CharlesLeggett156@gmail.com,http://localhost:9000/me-in-loo/posts/1067.jpg,None,5
AprilDuma157@gmail.com,None,None,3
LonnyMeyer158@gmail.com,http://localhost:9000/me-in-loo/posts/1068.jpg,None,3
NatashaNorrod159@gmail.com,http://localhost:9000/me-in-loo/posts/1069.jpg,Commercial address artist strong page.,0
TerryWilson160@gmail.com,http://localhost:9000/me-in-loo/posts/107.jpg,Score share push kid write box.,3
CatherineBishop161@gmail.com,None,None,202
AnneLerner162@gmail.com,None,None,3
MarioWilliamson163@gmail.com,None,As interesting event.,2
JustinAuten164@gmail.com,None,Top last central gas answer.,2
EmilyPeters165@gmail.com,None,None,0
DavidDrake166@gmail.com,None,Return interest wind law there treatment couple.,109
KathrynLeich167@gmail.com,http://localhost:9000/me-in-loo/posts/1070.jpg,Somebody pretty security may live.,2
AnnieRivera168@gmail.com,None,Day after control fight civil.,1
GeorgeKass169@gmail.com,None,None,1
RachelSmith170@gmail.com,http://localhost:9000/me-in-loo/posts/1071.jpg,Outside writer human upon community late.,4
EricMcgill171@gmail.com,http://localhost:9000/me-in-loo/posts/1072.jpg,None,0
JohnnyLocks172@gmail.com,http://localhost:9000/me-in-loo/posts/1073.jpg,Understand no generation yet meeting do most.,107
RonaldWallace173@gmail.com,http://localhost:9000/me-in-loo/posts/1074.jpg,Expect attack south check yard better material.,3
SteveSimpson174@gmail.com,http://localhost:9000/me-in-loo/posts/1075.jpg,End score true feel possible see church.,3
VirginiaRichardson175@gmail.com,http://localhost:9000/me-in-loo/posts/1076.jpg,Store probably individual easy poor.,0
JosiahLopez176@gmail.com,None,None,1
NathanielScarce177@gmail.com,None,Break they thing run.,3
DennisSmoot178@gmail.com,None,May human must sister central hit eye minute.,1
BryonCarvalho179@gmail.com,http://localhost:9000/me-in-loo/posts/1077.jpg,In term usually loss natural.,0
DebraHowell180@gmail.com,http://localhost:9000/me-in-loo/posts/1078.jpg,Share fish meeting item during policy.,2
VeronicaRogers181@gmail.com,http://localhost:9000/me-in-loo/posts/1079.jpg,However around want station.,2
MabelAlvarez182@gmail.com,http://localhost:9000/me-in-loo/posts/108.jpg,None,0
IrisKozma183@gmail.com,http://localhost:9000/me-in-loo/posts/1080.jpg,None,0
MildredMalveaux184@gmail.com,None,Positive within tough step color follow.,2
BrandySimonton185@gmail.com,http://localhost:9000/me-in-loo/posts/1081.jpg,None,2
LewisJohnson186@gmail.com,http://localhost:9000/me-in-loo/posts/1082.jpg,Difficult technology member adult magazine.,3
CrystalPitts187@gmail.com,http://localhost:9000/me-in-loo/posts/1083.jpg,Line door customer expert federal positive trial.,3
JamesPavlick188@gmail.com,http://localhost:9000/me-in-loo/posts/1084.jpg,None,3
RobertChurch189@gmail.com,None,None,3
JamesCramer190@gmail.com,http://localhost:9000/me-in-loo/posts/1085.jpg,Any purpose newspaper by dinner.,0
DarleneSturges191@gmail.com,None,Way guy grow detail.,145
GertudeOconnor192@gmail.com,http://localhost:9000/me-in-loo/posts/1086.jpg,Father support information.,0
ChristopherGeist193@gmail.com,http://localhost:9000/me-in-loo/posts/1087.jpg,None,0
JohnnieHensley194@gmail.com,http://localhost:9000/me-in-loo/posts/1088.jpg,Hospital president establish argue.,3
AllisonTuck195@gmail.com,http://localhost:9000/me-in-loo/posts/1089.jpg,Somebody hundred doctor fly seat your nearly democratic.,2
MariaRichardson196@gmail.com,None,None,4
KelseyDowns197@gmail.com,http://localhost:9000/me-in-loo/posts/109.jpg,Time world join.,0
BradleyLehmann198@gmail.com,http://localhost:9000/me-in-loo/posts/1090.jpg,Usually lawyer reach later surface interest Democrat.,0
CharlotteWelty199@gmail.com,http://localhost:9000/me-in-loo/posts/1091.jpg,Reach here any none foot affect.,2
GeneMoreau200@gmail.com,http://localhost:9000/me-in-loo/posts/1092.jpg,None,3
GayleVerity201@gmail.com,None,Race color deal make just himself.,2
AnnieSowell202@gmail.com,http://localhost:9000/me-in-loo/posts/1093.jpg,None,2
RitaLavery203@gmail.com,http://localhost:9000/me-in-loo/posts/1094.jpg,None,2
JohnMora204@gmail.com,None,Quite tough dark wear.,1
RuthannLachenauer205@gmail.com,None,Whose past we line.,1
RebeccaStadther206@gmail.com,http://localhost:9000/me-in-loo/posts/1095.jpg,Better trade should claim pretty.,3
WilliamHarris207@gmail.com,http://localhost:9000/me-in-loo/posts/1096.jpg,Whole lawyer daughter store study.,3
FrankMoua208@gmail.com,http://localhost:9000/me-in-loo/posts/1097.jpg,Budget term positive option serious.,0
JorgePhillips209@gmail.com,http://localhost:9000/me-in-loo/posts/1098.jpg,None,5
ClarenceLandry210@gmail.com,http://localhost:9000/me-in-loo/posts/1099.jpg,Game stay little three southern but keep near.,1
MichaelReed211@gmail.com,http://localhost:9000/me-in-loo/posts/11.jpg,None,2
JonathanRyan212@gmail.com,http://localhost:9000/me-in-loo/posts/110.jpg,President explain town during owner.,0
EmmaOconnor213@gmail.com,None,Very look vote tell edge.,0
RobertRegnier214@gmail.com,http://localhost:9000/me-in-loo/posts/1100.jpg,Professor develop candidate respond behavior available.,3
DerekHertzler215@gmail.com,http://localhost:9000/me-in-loo/posts/1101.jpg,None,1
AdaVerstraete216@gmail.com,None,None,3
KeithPinsky217@gmail.com,http://localhost:9000/me-in-loo/posts/1102.jpg,Government off size all reflect cultural.,3
AntoninaSmialek218@gmail.com,None,He sense treatment within PM people provide.,1
KaitlynMelgoza219@gmail.com,None,Minute measure him join either worry.,1
DavidByerly220@gmail.com,http://localhost:9000/me-in-loo/posts/1103.jpg,Then support art visit.,0
JudithDavis221@gmail.com,http://localhost:9000/me-in-loo/posts/1104.jpg,Member material citizen education consumer.,3
ElaineHarris222@gmail.com,http://localhost:9000/me-in-loo/posts/1105.jpg,I good recognize condition together material along.,3
NicoleCostello223@gmail.com,None,Place democratic eight understand.,3
LeliaLott224@gmail.com,http://localhost:9000/me-in-loo/posts/1106.jpg,None,0
ClarenceMeade225@gmail.com,http://localhost:9000/me-in-loo/posts/1107.jpg,None,0
DavidMansi226@gmail.com,http://localhost:9000/me-in-loo/posts/1108.jpg,None,2
KarlMiller227@gmail.com,http://localhost:9000/me-in-loo/posts/1109.jpg,Happen play mention focus.,1
DeniseAllen228@gmail.com,http://localhost:9000/me-in-loo/posts/111.jpg,None,3
EuniceBowman229@gmail.com,http://localhost:9000/me-in-loo/posts/1110.jpg,Hour role represent.,0
JamesBarrett230@gmail.com,http://localhost:9000/me-in-loo/posts/1111.jpg,None,1
MonicaDishong231@gmail.com,http://localhost:9000/me-in-loo/posts/1112.jpg,None,2
JoseReed232@gmail.com,http://localhost:9000/me-in-loo/posts/1113.jpg,During water girl night would.,0
RobertNichols233@gmail.com,http://localhost:9000/me-in-loo/posts/1114.jpg,Minute any nearly week decision executive training might.,0
GastonTinker234@gmail.com,http://localhost:9000/me-in-loo/posts/112.jpg,Bill rate rise discover family property.,0
MauriceWeldon235@gmail.com,None,Such section area.,1
JoeAyers236@gmail.com,None,None,3
HeidiStewart237@gmail.com,None,Often least every success.,0
JessicaAustin238@gmail.com,http://localhost:9000/me-in-loo/posts/113.jpg,Medical property spend consumer wind trial act.,0
SteveAtkins239@gmail.com,None,Address beat without.,2
EarlMccourt240@gmail.com,None,Position stop order argue.,0
StephenChapman241@gmail.com,http://localhost:9000/me-in-loo/posts/114.jpg,Rather successful contain.,3
BettyAdams242@gmail.com,None,None,3
VincentMeyers243@gmail.com,http://localhost:9000/me-in-loo/posts/115.jpg,None,0
LawrenceEdemann244@gmail.com,http://localhost:9000/me-in-loo/posts/116.jpg,None,0
CassaundraSmith245@gmail.com,None,Mention civil technology view possible culture.,1
RaySimmons246@gmail.com,None,Over method goal woman war agent.,1
ConnieFrank247@gmail.com,None,None,1
MargaretGriffin248@gmail.com,http://localhost:9000/me-in-loo/posts/117.jpg,None,1
RenatoSiler249@gmail.com,None,None,3
AngeloPittman250@gmail.com,None,Nor customer break specific happen sit.,2
BettyBurbridge251@gmail.com,http://localhost:9000/me-in-loo/posts/118.jpg,Down feel education everybody peace.,0
JessicaKash252@gmail.com,http://localhost:9000/me-in-loo/posts/119.jpg,Pick party think.,1
MadelineMorvant253@gmail.com,None,Commercial one I seven control onto.,1
PatriciaStuber254@gmail.com,http://localhost:9000/me-in-loo/posts/12.jpg,Start law young resource.,0
DanaVail255@gmail.com,http://localhost:9000/me-in-loo/posts/120.jpg,Student official forward player.,2
SamanthaCain256@gmail.com,http://localhost:9000/me-in-loo/posts/121.jpg,Music drug sense school great from table current.,267
IvyLynn257@gmail.com,http://localhost:9000/me-in-loo/posts/122.jpg,Marriage more stop.,3
DaisyTunson258@gmail.com,http://localhost:9000/me-in-loo/posts/123.jpg,Product another control decade.,0
KennethMcgowan259@gmail.com,http://localhost:9000/me-in-loo/posts/124.jpg,None,3
ColleenCharles260@gmail.com,http://localhost:9000/me-in-loo/posts/125.jpg,Form how issue.,1
GregForster261@gmail.com,None,Member bring son account popular debate.,0
ShirleyMoore262@gmail.com,http://localhost:9000/me-in-loo/posts/126.jpg,And business idea argue.,0
JamesMorgen263@gmail.com,http://localhost:9000/me-in-loo/posts/127.jpg,Why might value add current ball.,3
JavierChapa264@gmail.com,http://localhost:9000/me-in-loo/posts/128.jpg,Easy safe actually way data.,3
JamesHelton265@gmail.com,http://localhost:9000/me-in-loo/posts/129.jpg,Add end dog commercial science.,5
MarkBurnett266@gmail.com,http://localhost:9000/me-in-loo/posts/13.jpg,None,3
TamiLue267@gmail.com,http://localhost:9000/me-in-loo/posts/130.jpg,None,4
JermaineMyers268@gmail.com,None,Trial suddenly partner check agency summer.,3
HoraceOgaldez269@gmail.com,http://localhost:9000/me-in-loo/posts/131.jpg,None,0
DennisHollingsworth270@gmail.com,None,Already space fine strong environmental which figure rich.,2
BrendaScott271@gmail.com,None,Herself discuss relate nature.,2
DebraGuimond272@gmail.com,http://localhost:9000/me-in-loo/posts/132.jpg,Trip stand begin hand into debate real.,2
TommyWatson273@gmail.com,http://localhost:9000/me-in-loo/posts/133.jpg,Entire might system section we senior.,0
MariaMcdowell274@gmail.com,http://localhost:9000/me-in-loo/posts/134.jpg,Rise three money say two read you.,0
RoyMartinez275@gmail.com,http://localhost:9000/me-in-loo/posts/135.jpg,None,0
SusanPregler276@gmail.com,None,Deal along industry take large everything strong.,145
LisaTate277@gmail.com,http://localhost:9000/me-in-loo/posts/136.jpg,Real throw remain grow defense through letter.,2
ChristineGlass278@gmail.com,http://localhost:9000/me-in-loo/posts/137.jpg,Perform box south hair discover.,3
JerryLewis279@gmail.com,http://localhost:9000/me-in-loo/posts/138.jpg,None,5
LindaDesjardins280@gmail.com,None,None,0
JamesFluitt281@gmail.com,http://localhost:9000/me-in-loo/posts/139.jpg,None,2
RoxaneRamos282@gmail.com,None,Government sell draw fund.,3
BrittneyHintz283@gmail.com,http://localhost:9000/me-in-loo/posts/14.jpg,None,2
JamesSmith284@gmail.com,None,None,2
ChristianPatino285@gmail.com,None,None,0
AntonioDillard286@gmail.com,None,Consider nation push painting stock party stop ready.,0
VictorBorchardt287@gmail.com,None,Three about set science size whose list quality.,0
