JamesCollins577@gmail.com,None,Art lead within research station blood.,0
WilliamDavenport578@gmail.com,None,Film future federal future sit increase.,0
LynellGough579@gmail.com,None,Area answer charge.,0
NinaBrennan580@gmail.com,http://localhost:9000/me-in-loo/posts/328.jpg,None,0
GladysOzzella581@gmail.com,None,None,0
TonyHays582@gmail.com,None,None,0
WilmaLaguire583@gmail.com,None,None,0
MichaelGoodman584@gmail.com,http://localhost:9000/me-in-loo/posts/329.jpg,Recently stock gas local it.,0
AprilYeoman585@gmail.com,http://localhost:9000/me-in-loo/posts/33.jpg,Try main unit financial financial building.,0
LamarPeer586@gmail.com,None,Head beautiful ability available agree film.,0
ThomasDiaz587@gmail.com,http://localhost:9000/me-in-loo/posts/330.jpg,After media least.,0
MichelleJones588@gmail.com,http://localhost:9000/me-in-loo/posts/331.jpg,Great fish school it alone.,0
DuaneJones589@gmail.com,http://localhost:9000/me-in-loo/posts/332.jpg,Smile left spring risk score.,0
KathleenBailey590@gmail.com,http://localhost:9000/me-in-loo/posts/333.jpg,None,0
FeliciaJohnson591@gmail.com,http://localhost:9000/me-in-loo/posts/334.jpg,None,0
EvelynCastle592@gmail.com,http://localhost:9000/me-in-loo/posts/335.jpg,None,0
VioletThorsness593@gmail.com,http://localhost:9000/me-in-loo/posts/336.jpg,Sure will today life who.,0
LauraTyree594@gmail.com,http://localhost:9000/me-in-loo/posts/337.jpg,Year apply hand teacher contain why measure.,0
JohnCutter595@gmail.com,http://localhost:9000/me-in-loo/posts/338.jpg,Consider believe us series.,0
AaronFlournoy596@gmail.com,None,Candidate oil care.,0
MichaelAgustin597@gmail.com,http://localhost:9000/me-in-loo/posts/339.jpg,Back marriage list seek a population believe.,0
PhillipBennett598@gmail.com,None,Away public quickly listen anything.,0
NathanStockman599@gmail.com,http://localhost:9000/me-in-loo/posts/34.jpg,Foreign bring so which beat cost.,0
ChayaWhitt600@gmail.com,http://localhost:9000/me-in-loo/posts/340.jpg,None,0
NancyLayman601@gmail.com,http://localhost:9000/me-in-loo/posts/341.jpg,Hear least people detail.,0
BrendanOconnell602@gmail.com,http://localhost:9000/me-in-loo/posts/342.jpg,Wife buy must sea these.,0
ZacharyJohnson603@gmail.com,http://localhost:9000/me-in-loo/posts/343.jpg,Product could series government carry.,0
KeithTruss604@gmail.com,http://localhost:9000/me-in-loo/posts/344.jpg,Save meet east message.,0
CharlesDavis605@gmail.com,None,None,0
CharlesStevens606@gmail.com,http://localhost:9000/me-in-loo/posts/345.jpg,Ground table several actually project.,0
JeanetteCollins607@gmail.com,http://localhost:9000/me-in-loo/posts/346.jpg,None,0
RichardLowe608@gmail.com,http://localhost:9000/me-in-loo/posts/347.jpg,None,0
DeborahGomez609@gmail.com,http://localhost:9000/me-in-loo/posts/348.jpg,Success of American world friend water.,0
MaeAndrews610@gmail.com,None,Sing participant create single.,0
CarolynAdams611@gmail.com,None,None,0
MelvinWright612@gmail.com,None,East both way short first charge case.,0
LillianWilliams613@gmail.com,None,None,0
WallaceSanots614@gmail.com,http://localhost:9000/me-in-loo/posts/349.jpg,None,0
AngeloTejeiro615@gmail.com,http://localhost:9000/me-in-loo/posts/35.jpg,Hold lay allow itself.,0
CindyGoss616@gmail.com,http://localhost:9000/me-in-loo/posts/350.jpg,None,0
ElizabethClaggett617@gmail.com,http://localhost:9000/me-in-loo/posts/351.jpg,Sea arm your activity.,0
EricMetz618@gmail.com,http://localhost:9000/me-in-loo/posts/352.jpg,Skill kid amount nature language amount sometimes.,0
EleanorBrown619@gmail.com,http://localhost:9000/me-in-loo/posts/353.jpg,None,0
HelenHemmen620@gmail.com,http://localhost:9000/me-in-loo/posts/354.jpg,Thank respond building leave happen image our.,0
AnnaHammer621@gmail.com,http://localhost:9000/me-in-loo/posts/355.jpg,Act north cold agreement.,0
TerrenceQuiroz622@gmail.com,http://localhost:9000/me-in-loo/posts/356.jpg,Dark employee government top investment record involve.,0
RobertKwok623@gmail.com,http://localhost:9000/me-in-loo/posts/357.jpg,Window this still one.,0
AileenMoore624@gmail.com,http://localhost:9000/me-in-loo/posts/358.jpg,Behavior point together staff former.,0
JenniferHaas625@gmail.com,http://localhost:9000/me-in-loo/posts/359.jpg,Player between deal.,0
LauraTait626@gmail.com,http://localhost:9000/me-in-loo/posts/36.jpg,None,0
EricBrown627@gmail.com,http://localhost:9000/me-in-loo/posts/360.jpg,None,0
JuliaHollander628@gmail.com,http://localhost:9000/me-in-loo/posts/361.jpg,Join order nature safe truth happen.,0
BerniceChamberlain629@gmail.com,None,None,0
JohnnyMarshall630@gmail.com,http://localhost:9000/me-in-loo/posts/362.jpg,None,0
HildaWells631@gmail.com,http://localhost:9000/me-in-loo/posts/363.jpg,Mouth first speech animal.,0
AnneRoudebush632@gmail.com,None,Turn film successful central also floor and available.,0
KarenHastings633@gmail.com,None,None,0
EleanorHagstrom634@gmail.com,http://localhost:9000/me-in-loo/posts/364.jpg,Special type approach where rather represent professor relationship.,0
VincentWest635@gmail.com,http://localhost:9000/me-in-loo/posts/365.jpg,Radio cup floor magazine test after.,0
LonnieCook636@gmail.com,None,None,0
CarolSwain637@gmail.com,None,Campaign everybody leader three firm miss edge.,0
KennethFloyd638@gmail.com,http://localhost:9000/me-in-loo/posts/366.jpg,Free so ahead little onto plant art.,0
KathleenFarr639@gmail.com,http://localhost:9000/me-in-loo/posts/367.jpg,Dinner until foot brother fact nature soon skin.,0
PeterBranson640@gmail.com,None,None,0
ShawnThomasson641@gmail.com,http://localhost:9000/me-in-loo/posts/368.jpg,Against say modern argue.,0
SusieGreenlee642@gmail.com,http://localhost:9000/me-in-loo/posts/369.jpg,Guess someone person senior end.,0
StanleyMeyer643@gmail.com,http://localhost:9000/me-in-loo/posts/37.jpg,None,0
WilliamReibert644@gmail.com,None,Political cost name reason day.,0
JosephFosnaugh645@gmail.com,http://localhost:9000/me-in-loo/posts/370.jpg,Agreement add director decision Republican put measure.,0
ThomasJohnson646@gmail.com,None,None,0
JessiePatterson647@gmail.com,http://localhost:9000/me-in-loo/posts/371.jpg,Administration also other help traditional fill according.,0
GuyShort648@gmail.com,http://localhost:9000/me-in-loo/posts/372.jpg,Subject painting partner.,0
GaryJohnson649@gmail.com,None,None,0
JohnDidonna650@gmail.com,None,None,0
ChesterFrederick651@gmail.com,http://localhost:9000/me-in-loo/posts/373.jpg,Measure I direction ago true.,0
FreidaMoore652@gmail.com,None,Effort page music take get.,0
HeatherTurner653@gmail.com,http://localhost:9000/me-in-loo/posts/374.jpg,Government performance energy cut.,0
VeraBradley654@gmail.com,None,Physical sense daughter avoid situation toward knowledge when.,0
ErnestRudd655@gmail.com,http://localhost:9000/me-in-loo/posts/375.jpg,Financial tree assume finish especially Republican example.,0
PaulGagnon656@gmail.com,http://localhost:9000/me-in-loo/posts/376.jpg,General hair baby four movement.,0
LonnieJohnson657@gmail.com,http://localhost:9000/me-in-loo/posts/377.jpg,Hold firm east letter hundred edge.,0
AmyMurphy658@gmail.com,http://localhost:9000/me-in-loo/posts/378.jpg,Affect kid research through their require special.,0
PeteBrown659@gmail.com,None,So stop drug next.,0
AlisonLewis660@gmail.com,http://localhost:9000/me-in-loo/posts/379.jpg,Candidate front plant happen decide situation bill.,0
VivanBohannon661@gmail.com,None,Kitchen card every such.,0
PaulMeyer662@gmail.com,http://localhost:9000/me-in-loo/posts/38.jpg,Race size economic go.,0
VincentVasquez663@gmail.com,http://localhost:9000/me-in-loo/posts/380.jpg,Personal increase wife similar attorney.,0
BrianBaxter664@gmail.com,http://localhost:9000/me-in-loo/posts/381.jpg,As his that enter defense strong say consumer.,0
JeanetteGailey665@gmail.com,http://localhost:9000/me-in-loo/posts/382.jpg,Building avoid this check beyond.,0
ElaineKeeney666@gmail.com,http://localhost:9000/me-in-loo/posts/383.jpg,Couple candidate poor product each human someone.,0
ShirleySanders667@gmail.com,http://localhost:9000/me-in-loo/posts/384.jpg,None,0
CecilScruggs668@gmail.com,None,Part mean dream food foreign authority because budget.,0
NicolePadilla669@gmail.com,http://localhost:9000/me-in-loo/posts/385.jpg,Partner environment few foreign.,0
DenaeKimbrough670@gmail.com,http://localhost:9000/me-in-loo/posts/386.jpg,None,0
FelixDawkins671@gmail.com,None,Minute late second blue environmental knowledge.,0
JeffreyOwens672@gmail.com,http://localhost:9000/me-in-loo/posts/387.jpg,Cover because customer shoulder though go whatever.,0
ErinOlsen673@gmail.com,http://localhost:9000/me-in-loo/posts/388.jpg,From national research support me.,0
BettyLeon674@gmail.com,http://localhost:9000/me-in-loo/posts/389.jpg,Save record history movie window night happen.,0
JoniWalker675@gmail.com,http://localhost:9000/me-in-loo/posts/39.jpg,Probably two method must.,0
SylviaAndrade676@gmail.com,http://localhost:9000/me-in-loo/posts/390.jpg,Source how full five five make several.,0
RudolphThomas677@gmail.com,http://localhost:9000/me-in-loo/posts/391.jpg,None,0
MarvinVess678@gmail.com,None,None,0
MariePoggio679@gmail.com,None,None,0
CharlesBrown680@gmail.com,http://localhost:9000/me-in-loo/posts/392.jpg,Fact factor enter into them program.,0
WilliamBryant681@gmail.com,None,Dinner grow foreign feeling return effect such interesting.,0
GeraldineEiben682@gmail.com,http://localhost:9000/me-in-loo/posts/393.jpg,Congress actually campaign discussion.,0
JuanBrandon683@gmail.com,http://localhost:9000/me-in-loo/posts/394.jpg,Game book shoulder science.,0
KatharineLusk684@gmail.com,http://localhost:9000/me-in-loo/posts/395.jpg,Foreign small red step learn big reality day.,0
WilliamCavazos685@gmail.com,http://localhost:9000/me-in-loo/posts/396.jpg,Term them teacher world material.,0
JoshAhlstrom686@gmail.com,http://localhost:9000/me-in-loo/posts/397.jpg,So plant only system six can serve.,0
DiannaShadle687@gmail.com,http://localhost:9000/me-in-loo/posts/398.jpg,None,0
PamelaBuri688@gmail.com,None,Save another political sea stay mind old.,0
RodolfoBrashear689@gmail.com,http://localhost:9000/me-in-loo/posts/399.jpg,Us risk want year building husband key.,0
LindaSchmidt690@gmail.com,None,None,0
CharlesDavis691@gmail.com,http://localhost:9000/me-in-loo/posts/4.jpg,Role professor trip public soldier TV nature him.,0
StevenAusdemore692@gmail.com,http://localhost:9000/me-in-loo/posts/40.jpg,Generation trial service.,0
RickyVarela693@gmail.com,http://localhost:9000/me-in-loo/posts/400.jpg,Remember decision energy I.,0
JamesWallis694@gmail.com,None,None,0
KristinYockey695@gmail.com,http://localhost:9000/me-in-loo/posts/401.jpg,Doctor dinner tough I.,0
AdellaHarmon696@gmail.com,http://localhost:9000/me-in-loo/posts/402.jpg,None,0
RhondaWilson697@gmail.com,http://localhost:9000/me-in-loo/posts/403.jpg,Five drive theory hot task soon require.,0
LelaPerez698@gmail.com,http://localhost:9000/me-in-loo/posts/404.jpg,None,0
DebraBrickley699@gmail.com,http://localhost:9000/me-in-loo/posts/405.jpg,Certainly structure technology daughter any color budget.,0
MaxGibbs700@gmail.com,None,Evening carry hit physical.,0
AnnaElam701@gmail.com,None,Admit several quality land attack.,0
AngelaHarris702@gmail.com,http://localhost:9000/me-in-loo/posts/406.jpg,Cut possible century finally.,0
ElnoraSumner703@gmail.com,http://localhost:9000/me-in-loo/posts/407.jpg,Mean report outside wind difference.,0
UnaWainer704@gmail.com,http://localhost:9000/me-in-loo/posts/408.jpg,Pm next smile laugh various interview.,0
KimberlyUlibarri705@gmail.com,http://localhost:9000/me-in-loo/posts/409.jpg,Address sit big drop skin window article.,0
MarkZimmerman706@gmail.com,None,Look service two item.,0
CarolThrower707@gmail.com,http://localhost:9000/me-in-loo/posts/41.jpg,Hot myself entire American win pretty role.,0
FrancineKinney708@gmail.com,http://localhost:9000/me-in-loo/posts/410.jpg,Mind member choice enter political.,0
DonnaWaters709@gmail.com,http://localhost:9000/me-in-loo/posts/411.jpg,None,0
CurtisRobinett710@gmail.com,http://localhost:9000/me-in-loo/posts/412.jpg,Others management evidence effect plant event.,0
DebraPodolsky711@gmail.com,None,Reflect anyone after office way example section.,0
DebbieWassermann712@gmail.com,http://localhost:9000/me-in-loo/posts/413.jpg,Group grow nothing attack must per.,0
JamesWilliams713@gmail.com,None,Expect style effect power.,0
HaroldStewart714@gmail.com,http://localhost:9000/me-in-loo/posts/414.jpg,Anyone new old bar.,0
EdwardSantiago715@gmail.com,http://localhost:9000/me-in-loo/posts/415.jpg,Outside sure lose air by subject second.,0
JohnParise716@gmail.com,http://localhost:9000/me-in-loo/posts/416.jpg,Level million specific arm drop.,0
PatriciaAllen717@gmail.com,http://localhost:9000/me-in-loo/posts/417.jpg,Movement should sign.,0
JohnMoir718@gmail.com,None,Main must operation leader small commercial.,0
DebrahArguelles719@gmail.com,http://localhost:9000/me-in-loo/posts/418.jpg,Money role benefit hour door.,0
JamesSorenson720@gmail.com,None,None,0
FatimaPhillips721@gmail.com,http://localhost:9000/me-in-loo/posts/419.jpg,Glass agreement practice.,0
DeliaWaters722@gmail.com,http://localhost:9000/me-in-loo/posts/42.jpg,None,0
DeloresEisner723@gmail.com,http://localhost:9000/me-in-loo/posts/420.jpg,None,0
RichardFrank724@gmail.com,http://localhost:9000/me-in-loo/posts/421.jpg,None,0
PhilipTerry725@gmail.com,None,None,0
HerbertHill726@gmail.com,http://localhost:9000/me-in-loo/posts/422.jpg,Glass sign because.,0
PamCruz727@gmail.com,http://localhost:9000/me-in-loo/posts/423.jpg,State mean middle case.,0
GayleLines728@gmail.com,http://localhost:9000/me-in-loo/posts/424.jpg,Start teacher or old.,0
GaryBurrage729@gmail.com,http://localhost:9000/me-in-loo/posts/425.jpg,Person upon support wish she a though.,0
JohnPowles730@gmail.com,http://localhost:9000/me-in-loo/posts/426.jpg,Kitchen specific consumer get back dark thousand.,0
DarinAdams731@gmail.com,http://localhost:9000/me-in-loo/posts/427.jpg,Arm effect statement involve figure.,0
AmberWedlow732@gmail.com,http://localhost:9000/me-in-loo/posts/428.jpg,Cell four remain since remember section manage miss.,0
JamesButler733@gmail.com,http://localhost:9000/me-in-loo/posts/429.jpg,None,0
AndrewBlaser734@gmail.com,http://localhost:9000/me-in-loo/posts/43.jpg,None,0
DavidMiller735@gmail.com,http://localhost:9000/me-in-loo/posts/430.jpg,Exactly today price ask.,0
AnthonyRivero736@gmail.com,http://localhost:9000/me-in-loo/posts/431.jpg,Win couple expert television account particularly writer end.,0
SandraHewitt737@gmail.com,http://localhost:9000/me-in-loo/posts/432.jpg,National among table such collection.,0
ShaunJephson738@gmail.com,http://localhost:9000/me-in-loo/posts/433.jpg,View Congress action alone without final nor surface.,0
AngelikaAlbarado739@gmail.com,http://localhost:9000/me-in-loo/posts/434.jpg,None,0
RobertEstes740@gmail.com,None,System pay west peace case something home.,0
ValerieBoldt741@gmail.com,http://localhost:9000/me-in-loo/posts/435.jpg,Professional simple already choose half single dinner.,0
JamesSnyder742@gmail.com,http://localhost:9000/me-in-loo/posts/436.jpg,Church dinner worker even.,0
GracieBurnham743@gmail.com,http://localhost:9000/me-in-loo/posts/437.jpg,Forget father bit turn.,0
MichaelBenesh744@gmail.com,http://localhost:9000/me-in-loo/posts/438.jpg,None,0
BernardRichardson745@gmail.com,http://localhost:9000/me-in-loo/posts/439.jpg,None,0
CharlotteRomon746@gmail.com,http://localhost:9000/me-in-loo/posts/44.jpg,Model feeling personal worry scene.,0
MildredBotello747@gmail.com,http://localhost:9000/me-in-loo/posts/440.jpg,None,0
DavidMansfield748@gmail.com,None,Close environment admit.,0
AlfredBennett749@gmail.com,None,Meeting certainly yes church.,0
JohnHernandez750@gmail.com,http://localhost:9000/me-in-loo/posts/441.jpg,None,0
WandaFrazier751@gmail.com,http://localhost:9000/me-in-loo/posts/442.jpg,Score tax from sense black evening class.,0
DeanSalgado752@gmail.com,http://localhost:9000/me-in-loo/posts/443.jpg,None,0
MarkBagwell753@gmail.com,http://localhost:9000/me-in-loo/posts/444.jpg,Would per across performance across magazine.,0
DarleneWilburn754@gmail.com,http://localhost:9000/me-in-loo/posts/445.jpg,Down region remember street suggest small.,0
ScottGonzalez755@gmail.com,http://localhost:9000/me-in-loo/posts/446.jpg,None,0
JoyceMyers756@gmail.com,None,Ability you contain various great.,0
CharlieBoggs757@gmail.com,http://localhost:9000/me-in-loo/posts/447.jpg,Question himself forget go write bed.,0
KennethCrawford758@gmail.com,http://localhost:9000/me-in-loo/posts/448.jpg,Stay public space relate.,0
JimmyPage759@gmail.com,http://localhost:9000/me-in-loo/posts/449.jpg,Message course avoid attack society lay item.,0
KimberlyAtchley760@gmail.com,http://localhost:9000/me-in-loo/posts/45.jpg,Involve official draw unit military reveal degree serious.,0
HaroldHarwood761@gmail.com,http://localhost:9000/me-in-loo/posts/450.jpg,Knowledge enter visit Democrat allow size others others.,0
TonyPerez762@gmail.com,None,Would oil interest sea.,0
JaniceHoward763@gmail.com,http://localhost:9000/me-in-loo/posts/451.jpg,None,0
JenniferGiron764@gmail.com,http://localhost:9000/me-in-loo/posts/452.jpg,To pretty race yard.,0
RigobertoHolley765@gmail.com,http://localhost:9000/me-in-loo/posts/453.jpg,Good debate democratic discover.,0
DebraCunningham766@gmail.com,http://localhost:9000/me-in-loo/posts/454.jpg,He area star mean.,0
MaryCyr767@gmail.com,http://localhost:9000/me-in-loo/posts/455.jpg,None,0
LenaLeach768@gmail.com,http://localhost:9000/me-in-loo/posts/456.jpg,None,0
RichardThomas769@gmail.com,http://localhost:9000/me-in-loo/posts/457.jpg,Method but system wrong no.,0
KristinaLangston770@gmail.com,http://localhost:9000/me-in-loo/posts/458.jpg,Area feel to toward.,0
JeremyCarpenter771@gmail.com,http://localhost:9000/me-in-loo/posts/459.jpg,Trial whatever goal school health model.,0
KevinMorataya772@gmail.com,None,Nor strong else conference series situation cup.,0
ChiekoBegay773@gmail.com,http://localhost:9000/me-in-loo/posts/46.jpg,Commercial brother dinner grow find need scene.,0
SharonHallowell774@gmail.com,http://localhost:9000/me-in-loo/posts/460.jpg,Policy executive red performance.,0
RonnieKoonce775@gmail.com,http://localhost:9000/me-in-loo/posts/461.jpg,Past suggest join spend civil.,0
GertrudeBallard776@gmail.com,http://localhost:9000/me-in-loo/posts/462.jpg,None,0
DavidEpps777@gmail.com,http://localhost:9000/me-in-loo/posts/463.jpg,Born probably while kitchen.,0
StephenBurge778@gmail.com,http://localhost:9000/me-in-loo/posts/464.jpg,Develop work door pass mother media.,0
StephenMcanally779@gmail.com,http://localhost:9000/me-in-loo/posts/465.jpg,Prepare each easy check choose oil budget.,0
DavidMoore780@gmail.com,None,None,0
GloriaBrown781@gmail.com,None,Those use shake figure safe.,0
GarlandRobles782@gmail.com,http://localhost:9000/me-in-loo/posts/466.jpg,None,0
BarbaraPosey783@gmail.com,http://localhost:9000/me-in-loo/posts/467.jpg,If edge together include line kid seek.,0
LisaPreston784@gmail.com,http://localhost:9000/me-in-loo/posts/468.jpg,None,0
PeterYoung785@gmail.com,http://localhost:9000/me-in-loo/posts/469.jpg,Foreign every amount thus.,0
FrancisLester786@gmail.com,http://localhost:9000/me-in-loo/posts/47.jpg,None,0
JamesCorum787@gmail.com,http://localhost:9000/me-in-loo/posts/470.jpg,Trip real site instead across dog.,0
IsabelGosser788@gmail.com,http://localhost:9000/me-in-loo/posts/471.jpg,Generation important father.,0
ClydeMorgan789@gmail.com,http://localhost:9000/me-in-loo/posts/472.jpg,Person strategy writer research special able sea.,0
HermanLeggett790@gmail.com,http://localhost:9000/me-in-loo/posts/473.jpg,None,0
SusanLeblanc791@gmail.com,http://localhost:9000/me-in-loo/posts/474.jpg,Year his group senior chair.,0
EricaAllison792@gmail.com,None,None,0
MariaHausmann793@gmail.com,None,None,0
MelvinField794@gmail.com,None,Top against green PM.,0
JamieMartin795@gmail.com,http://localhost:9000/me-in-loo/posts/475.jpg,Relationship all contain arm no.,0
LakishaBowling796@gmail.com,http://localhost:9000/me-in-loo/posts/476.jpg,None,0
HelenLee797@gmail.com,http://localhost:9000/me-in-loo/posts/477.jpg,Fall in indicate you quality.,0
ShirleyGreen798@gmail.com,http://localhost:9000/me-in-loo/posts/478.jpg,Us result tell trade between.,0
AltheaAbrego799@gmail.com,None,Clear here much save matter forward.,0
RuthBirks800@gmail.com,None,None,0
RubyJones801@gmail.com,http://localhost:9000/me-in-loo/posts/479.jpg,None,0
JewellGarcia802@gmail.com,http://localhost:9000/me-in-loo/posts/48.jpg,Someone they understand author computer.,0
PearlBarrett803@gmail.com,http://localhost:9000/me-in-loo/posts/480.jpg,None,0
CathleenHammen804@gmail.com,http://localhost:9000/me-in-loo/posts/481.jpg,Against boy then stop heavy appear.,0
MarvinMccoy805@gmail.com,http://localhost:9000/me-in-loo/posts/482.jpg,Result appear memory beautiful.,0
MichaelMcnutt806@gmail.com,http://localhost:9000/me-in-loo/posts/483.jpg,None,0
WilliamHidalgo807@gmail.com,http://localhost:9000/me-in-loo/posts/484.jpg,Money address increase commercial term actually usually.,0
JohnHill808@gmail.com,http://localhost:9000/me-in-loo/posts/485.jpg,Rule ten five long never.,0
GarySkar809@gmail.com,http://localhost:9000/me-in-loo/posts/486.jpg,Rather radio close especially from performance himself at.,0
ShannonOrona810@gmail.com,None,So represent throughout.,0
BryanDerby811@gmail.com,http://localhost:9000/me-in-loo/posts/487.jpg,Age believe black account become.,0
MichaelLorenz812@gmail.com,http://localhost:9000/me-in-loo/posts/488.jpg,None,0
JenniferDebem813@gmail.com,http://localhost:9000/me-in-loo/posts/489.jpg,Young policy house cup.,0
MurielJackson814@gmail.com,http://localhost:9000/me-in-loo/posts/49.jpg,Arrive develop together tough.,0
RobertParisien815@gmail.com,None,Human message win why.,0
DeannaGil816@gmail.com,http://localhost:9000/me-in-loo/posts/490.jpg,Reveal consumer radio send American.,0
JohnPhelps817@gmail.com,http://localhost:9000/me-in-loo/posts/491.jpg,Prepare player day size second nor hope off.,0
NancyLechleidner818@gmail.com,http://localhost:9000/me-in-loo/posts/492.jpg,None,0
BruceSnyder819@gmail.com,http://localhost:9000/me-in-loo/posts/493.jpg,Describe job fill cut however me.,0
ErnestHill820@gmail.com,http://localhost:9000/me-in-loo/posts/494.jpg,Respond staff no traditional full.,0
JackKing821@gmail.com,http://localhost:9000/me-in-loo/posts/495.jpg,None,0
ReginaFlanders822@gmail.com,http://localhost:9000/me-in-loo/posts/496.jpg,None,0
HarryMalick823@gmail.com,http://localhost:9000/me-in-loo/posts/497.jpg,None,0
MaryWalter824@gmail.com,None,None,0
RubyLee825@gmail.com,None,Lead decide customer amount TV community business red.,0
DorothyFrank826@gmail.com,http://localhost:9000/me-in-loo/posts/498.jpg,Usually coach draw public vote these attack.,0
ChristianNelson827@gmail.com,None,None,0
RachelSpitzer828@gmail.com,http://localhost:9000/me-in-loo/posts/499.jpg,None,0
JohnGream829@gmail.com,http://localhost:9000/me-in-loo/posts/5.jpg,Doctor peace she policy.,0
MerleWebb830@gmail.com,None,Mind way painting produce growth all.,0
HazelCody831@gmail.com,http://localhost:9000/me-in-loo/posts/50.jpg,Sea vote word.,0
LeoraThomas832@gmail.com,None,None,0
MaryErvin833@gmail.com,None,Nearly field investment week shoulder him.,0
SonjaHudson834@gmail.com,http://localhost:9000/me-in-loo/posts/500.jpg,For rise miss any agent.,0
LisaMeredith835@gmail.com,None,Run process song detail within image cause history.,0
LoriCastro836@gmail.com,http://localhost:9000/me-in-loo/posts/501.jpg,Daughter high be life design.,0
JamesDurisseau837@gmail.com,http://localhost:9000/me-in-loo/posts/502.jpg,None,0
MariaDrew838@gmail.com,http://localhost:9000/me-in-loo/posts/503.jpg,Although student these require into matter military.,0
RuthJellerson839@gmail.com,None,Include environment check box.,0
JohnnyGomes840@gmail.com,http://localhost:9000/me-in-loo/posts/504.jpg,None,0
MarkBrown841@gmail.com,http://localhost:9000/me-in-loo/posts/505.jpg,Seek human science notice.,0
MariaRodriguez842@gmail.com,http://localhost:9000/me-in-loo/posts/506.jpg,More dream drive defense win hospital decision.,0
KevinCampion843@gmail.com,http://localhost:9000/me-in-loo/posts/507.jpg,View member field.,0
BruceSmith844@gmail.com,http://localhost:9000/me-in-loo/posts/508.jpg,Worry after message material raise.,0
ErickCarter845@gmail.com,http://localhost:9000/me-in-loo/posts/509.jpg,American cell allow owner available.,0
LindaWilliams846@gmail.com,None,None,0
JohnDean847@gmail.com,None,Lawyer still along player thought car number writer.,0
TerryWilliams848@gmail.com,http://localhost:9000/me-in-loo/posts/51.jpg,Large statement account movie key.,0
SarahSkowron849@gmail.com,None,Power pattern south parent role party.,0
RichardMiller850@gmail.com,None,Government style court go.,0
NelsonMcclurg851@gmail.com,http://localhost:9000/me-in-loo/posts/510.jpg,Stand message thank page.,0
AngelaMcfaul852@gmail.com,None,Bill off stand eat continue somebody financial.,0
JamesDiaz853@gmail.com,None,None,0
CharissaValdez854@gmail.com,http://localhost:9000/me-in-loo/posts/511.jpg,Say perform style drug fight debate.,0
RafaelRodriquez855@gmail.com,None,Huge fire century about ok.,0
BlancheProvost856@gmail.com,http://localhost:9000/me-in-loo/posts/512.jpg,Own too law all million.,0
KevinJarrett857@gmail.com,None,None,0
GlennTyre858@gmail.com,http://localhost:9000/me-in-loo/posts/513.jpg,Small industry fire.,0
MariettaPartin859@gmail.com,http://localhost:9000/me-in-loo/posts/514.jpg,None,0
LeonorZymowski860@gmail.com,http://localhost:9000/me-in-loo/posts/515.jpg,Stuff hear late adult this know mouth.,0
KatherineRabenold861@gmail.com,http://localhost:9000/me-in-loo/posts/516.jpg,Since write also.,0
JamesBrundage862@gmail.com,None,Course chair bill all wife grow.,0
JamieGuerrera863@gmail.com,http://localhost:9000/me-in-loo/posts/517.jpg,Team war president staff.,0
