MarvinKraus864@gmail.com,http://localhost:9000/me-in-loo/posts/518.jpg,Represent office mean red commercial.,0
AracelyBarrera865@gmail.com,None,Various who real form.,0
MelodyKelly866@gmail.com,None,Top weight identify eye.,0
BryanBurns867@gmail.com,http://localhost:9000/me-in-loo/posts/519.jpg,His body be price apply and various.,0
JoshuaRichards868@gmail.com,http://localhost:9000/me-in-loo/posts/52.jpg,None,0
JosephCoburn869@gmail.com,http://localhost:9000/me-in-loo/posts/520.jpg,None,0
AlysonWeaver870@gmail.com,http://localhost:9000/me-in-loo/posts/521.jpg,Voice mind minute.,0
JamesDiaz871@gmail.com,http://localhost:9000/me-in-loo/posts/522.jpg,Deal enjoy guy health hold simply likely.,0
ChristopherYoungblood872@gmail.com,http://localhost:9000/me-in-loo/posts/523.jpg,Campaign later past remember it use side.,0
MatthewBurge873@gmail.com,http://localhost:9000/me-in-loo/posts/524.jpg,Term recently nice type deal reveal whatever police.,0
DavidOberholtzer874@gmail.com,None,Defense television still.,0
JamesRea875@gmail.com,http://localhost:9000/me-in-loo/posts/525.jpg,Good spend apply husband.,0
RobertGreen876@gmail.com,None,Nature wear two investment computer.,0
ErikFalls877@gmail.com,None,These like think table main simple.,0
JoelMory878@gmail.com,http://localhost:9000/me-in-loo/posts/526.jpg,Party particular me current.,0
FranciscoRaybon879@gmail.com,http://localhost:9000/me-in-loo/posts/527.jpg,Save positive sort issue world candidate size.,0
JenniferSteinberg880@gmail.com,http://localhost:9000/me-in-loo/posts/528.jpg,Family add account door wife.,0
RitaCoberly881@gmail.com,None,None,0
DeidraSeaver882@gmail.com,None,Heart court grow spend imagine personal.,0
ElsieBaker883@gmail.com,http://localhost:9000/me-in-loo/posts/529.jpg,Way win brother off so you claim.,0
OwenGray884@gmail.com,http://localhost:9000/me-in-loo/posts/53.jpg,None,0
WillieMency885@gmail.com,http://localhost:9000/me-in-loo/posts/530.jpg,Himself suggest place crime rich nothing.,0
DwayneFannell886@gmail.com,http://localhost:9000/me-in-loo/posts/531.jpg,Occur want difference agreement.,0
WilliamBrown887@gmail.com,http://localhost:9000/me-in-loo/posts/532.jpg,Under memory study however high.,0
SamuelNeubauer888@gmail.com,None,None,0
AlysonHyde889@gmail.com,http://localhost:9000/me-in-loo/posts/533.jpg,None,0
AngelaPerault890@gmail.com,http://localhost:9000/me-in-loo/posts/534.jpg,Receive vote brother crime travel actually if miss.,0
RoyGergen891@gmail.com,http://localhost:9000/me-in-loo/posts/535.jpg,None,0
RichardPaetzold892@gmail.com,http://localhost:9000/me-in-loo/posts/536.jpg,None,0
NigelMoore893@gmail.com,None,Several before process role product whom.,0
FionaJacobs894@gmail.com,http://localhost:9000/me-in-loo/posts/537.jpg,Compare man where officer.,0
JoanWidmer895@gmail.com,http://localhost:9000/me-in-loo/posts/538.jpg,Rise situation decision family result follow.,0
DeborahHiggins896@gmail.com,http://localhost:9000/me-in-loo/posts/539.jpg,Scene factor friend management clearly upon coach edge.,0
KathyHarrison897@gmail.com,None,None,0
MaryBarnett898@gmail.com,http://localhost:9000/me-in-loo/posts/54.jpg,None,0
CarolMast899@gmail.com,None,None,0
JefferyAikens900@gmail.com,http://localhost:9000/me-in-loo/posts/540.jpg,Lot speech section less up American.,0
MarinaCasas901@gmail.com,None,Provide ball business drive pull learn.,0
JefferyVerhoeven902@gmail.com,None,Over its character writer.,0
MaryJones903@gmail.com,http://localhost:9000/me-in-loo/posts/541.jpg,Speech car enough force whole run.,0
KarenWindham904@gmail.com,http://localhost:9000/me-in-loo/posts/542.jpg,Knowledge effort yeah until would from grow.,0
RonaldWilliams905@gmail.com,http://localhost:9000/me-in-loo/posts/543.jpg,Site boy reach professional management herself two.,0
AnneStone906@gmail.com,http://localhost:9000/me-in-loo/posts/544.jpg,Account seem happen although heart cause attention.,0
LauraLorusso907@gmail.com,http://localhost:9000/me-in-loo/posts/545.jpg,Up spend answer long particular center room.,0
MichaelGross908@gmail.com,http://localhost:9000/me-in-loo/posts/546.jpg,Security floor wish floor.,0
DorisWhitten909@gmail.com,http://localhost:9000/me-in-loo/posts/547.jpg,Around perform behavior memory employee indeed.,0
LaurenHurrington910@gmail.com,http://localhost:9000/me-in-loo/posts/548.jpg,None,0
ElizabethGresham911@gmail.com,None,Language hundred large return able like own.,0
KatherineBurnham912@gmail.com,http://localhost:9000/me-in-loo/posts/549.jpg,Pattern approach very part person eight fish.,0
ThomasMarshall913@gmail.com,http://localhost:9000/me-in-loo/posts/55.jpg,Traditional resource network ok successful check.,0
TravisCastro914@gmail.com,http://localhost:9000/me-in-loo/posts/550.jpg,None,0
ChristinaKennan915@gmail.com,None,Tonight seven explain difficult.,0
NathanialCarswell916@gmail.com,http://localhost:9000/me-in-loo/posts/551.jpg,None,0
ThomasArellano917@gmail.com,None,Well production blue each provide.,0
PamelaPosner918@gmail.com,http://localhost:9000/me-in-loo/posts/552.jpg,Southern be seat cut lose.,0
LilyGiannakopoulo919@gmail.com,http://localhost:9000/me-in-loo/posts/553.jpg,Wide practice sound sea station.,0
ElenaBurns920@gmail.com,None,None,0
JessicaChristian921@gmail.com,http://localhost:9000/me-in-loo/posts/554.jpg,Near protect health marriage long single its bad.,0
VeraLang922@gmail.com,None,Question note provide.,0
MicheleHumphrey923@gmail.com,None,None,0
MickiAnderson924@gmail.com,http://localhost:9000/me-in-loo/posts/555.jpg,Language pattern civil rise face star look officer.,0
MaryWilkerson925@gmail.com,http://localhost:9000/me-in-loo/posts/556.jpg,Nation religious least admit.,0
MaryHaskell926@gmail.com,http://localhost:9000/me-in-loo/posts/557.jpg,None,0
LaurenWhitten927@gmail.com,http://localhost:9000/me-in-loo/posts/558.jpg,None,0
MichaelSampsell928@gmail.com,http://localhost:9000/me-in-loo/posts/559.jpg,Station similar car edge example.,0
MarthaLacroix929@gmail.com,http://localhost:9000/me-in-loo/posts/56.jpg,Lose size both buy shoulder point partner.,0
GingerMaddux930@gmail.com,http://localhost:9000/me-in-loo/posts/560.jpg,Ok middle throw wind break threat particular set.,0
ChristopherMesser931@gmail.com,http://localhost:9000/me-in-loo/posts/561.jpg,None,0
JesseBott932@gmail.com,http://localhost:9000/me-in-loo/posts/562.jpg,Set happen generation form project form plant.,0
BrookeSingletary933@gmail.com,None,Finish environmental thought.,0
JudithMoreno934@gmail.com,http://localhost:9000/me-in-loo/posts/563.jpg,None,0
RobertMccallum935@gmail.com,http://localhost:9000/me-in-loo/posts/564.jpg,Certainly magazine according might cell lead.,0
VincentRace936@gmail.com,http://localhost:9000/me-in-loo/posts/565.jpg,Concern build know TV expert strategy.,0
FrankPengelly937@gmail.com,None,None,0
MelisaGaines938@gmail.com,http://localhost:9000/me-in-loo/posts/566.jpg,None,0
RussellCahn939@gmail.com,http://localhost:9000/me-in-loo/posts/567.jpg,Hear gun hear somebody push feeling.,0
BettyCox940@gmail.com,None,Art result consider necessary mouth enter threat.,0
JacquelineWyche941@gmail.com,http://localhost:9000/me-in-loo/posts/568.jpg,None,0
SaraDesimone942@gmail.com,http://localhost:9000/me-in-loo/posts/569.jpg,Get parent mission mission matter concern outside.,0
NancyMoore943@gmail.com,http://localhost:9000/me-in-loo/posts/57.jpg,None,0
RachelTatel944@gmail.com,http://localhost:9000/me-in-loo/posts/570.jpg,Professor state street television collection up instead.,0
StevenSibert945@gmail.com,http://localhost:9000/me-in-loo/posts/571.jpg,None,0
LindaSmith946@gmail.com,http://localhost:9000/me-in-loo/posts/572.jpg,Raise responsibility military ground Republican.,0
SavannahBerends947@gmail.com,None,Fly there audience fight especially change off.,0
PaulHampton948@gmail.com,http://localhost:9000/me-in-loo/posts/573.jpg,College forget game.,0
MurielJohnston949@gmail.com,None,Need tend owner old pull executive world right.,0
AlexanderDudley950@gmail.com,None,Tax right reason modern.,0
ToddMendez951@gmail.com,http://localhost:9000/me-in-loo/posts/574.jpg,See world specific over door remember.,0
ElizabethSchrader952@gmail.com,http://localhost:9000/me-in-loo/posts/575.jpg,Through enough garden walk at.,0
JerrySpencer953@gmail.com,http://localhost:9000/me-in-loo/posts/576.jpg,Quite true my year.,0
RandyEdwards954@gmail.com,None,Least public add citizen.,0
MaryannRoy955@gmail.com,http://localhost:9000/me-in-loo/posts/577.jpg,Then key issue week main Congress.,0
StephenJanzen956@gmail.com,None,Move between simply several never.,0
JanisLietzke957@gmail.com,http://localhost:9000/me-in-loo/posts/578.jpg,Clearly stop arm class worker individual indicate.,0
DavidMerrill958@gmail.com,http://localhost:9000/me-in-loo/posts/579.jpg,None,0
JillAllen959@gmail.com,http://localhost:9000/me-in-loo/posts/58.jpg,None,0
AliceBeal960@gmail.com,None,East direction bed from certain enough beyond.,0
DorothyMinor961@gmail.com,http://localhost:9000/me-in-loo/posts/580.jpg,Tax heart institution.,0
ThomasRobertson962@gmail.com,http://localhost:9000/me-in-loo/posts/581.jpg,None,0
RicardoConroy963@gmail.com,http://localhost:9000/me-in-loo/posts/582.jpg,Doctor happen west similar court born.,0
TamaraOoten964@gmail.com,http://localhost:9000/me-in-loo/posts/583.jpg,None,0
AmySpickard965@gmail.com,http://localhost:9000/me-in-loo/posts/584.jpg,None,0
WilliamMcgough966@gmail.com,http://localhost:9000/me-in-loo/posts/585.jpg,Share discussion class no lot senior right.,0
RobertWilliams967@gmail.com,None,Just sort rather talk news be first.,0
DebraLindquist968@gmail.com,None,Old very four goal.,0
DanielCoyle969@gmail.com,http://localhost:9000/me-in-loo/posts/586.jpg,Guess half decade.,0
CarolineWitt970@gmail.com,None,None,0
AmberRosario971@gmail.com,None,Policy how loss option throw amount political.,0
MatthewVerhaag972@gmail.com,http://localhost:9000/me-in-loo/posts/587.jpg,None,0
LauraEdwards973@gmail.com,http://localhost:9000/me-in-loo/posts/588.jpg,Growth interview wait like popular what.,0
RichardRay974@gmail.com,http://localhost:9000/me-in-loo/posts/589.jpg,Free agency government parent.,0
LuzLovell975@gmail.com,http://localhost:9000/me-in-loo/posts/59.jpg,Culture enough leg look organization trouble particular college.,0
KristenDiaz976@gmail.com,None,None,0
WilliamGullixson977@gmail.com,None,None,0
AngelaBerryman978@gmail.com,http://localhost:9000/me-in-loo/posts/590.jpg,Several near want major.,0
WilliamJudd979@gmail.com,None,Trip read difference growth food approach business more.,0
RobertYang980@gmail.com,http://localhost:9000/me-in-loo/posts/591.jpg,None,0
ShirleyJenkins981@gmail.com,http://localhost:9000/me-in-loo/posts/592.jpg,Smile eye develop democratic rate central.,0
HarveyAybar982@gmail.com,http://localhost:9000/me-in-loo/posts/593.jpg,None,0
ChristopherGunnell983@gmail.com,http://localhost:9000/me-in-loo/posts/594.jpg,Hundred effort upon have.,0
MarkFlower984@gmail.com,http://localhost:9000/me-in-loo/posts/595.jpg,None,0
JocelynCorlew985@gmail.com,http://localhost:9000/me-in-loo/posts/596.jpg,Among prepare federal instead.,0
PaulTraynor986@gmail.com,None,None,0
GeraldineMcclane987@gmail.com,http://localhost:9000/me-in-loo/posts/597.jpg,None,0
DesireeBrown988@gmail.com,None,Billion reality rise choice.,0
CindyGreen989@gmail.com,http://localhost:9000/me-in-loo/posts/598.jpg,None,0
JonScheller990@gmail.com,http://localhost:9000/me-in-loo/posts/599.jpg,Three economy hour traditional.,0
HelenIsom991@gmail.com,http://localhost:9000/me-in-loo/posts/6.jpg,None,0
DarrellSpells992@gmail.com,None,Wind gun which.,0
ElsieCelis993@gmail.com,http://localhost:9000/me-in-loo/posts/60.jpg,From fine race off.,0
ColleenThompson994@gmail.com,http://localhost:9000/me-in-loo/posts/600.jpg,Paper long rest new.,0
CandelariaFitzpatrick995@gmail.com,None,Theory miss property star wind manager protect than.,0
ClydeHibner996@gmail.com,None,None,0
CherylHerbert997@gmail.com,None,Lay outside price where.,0
BenjaminBrentson998@gmail.com,http://localhost:9000/me-in-loo/posts/601.jpg,Individual true oil just tree leave act.,0
JohnCampbell999@gmail.com,http://localhost:9000/me-in-loo/posts/602.jpg,Past often create fine democratic by.,0
SallieBeavers1000@gmail.com,http://localhost:9000/me-in-loo/posts/603.jpg,Owner group process role enough.,0
